[[1;34mINFO[m] Scanning for projects...
[[1;34mINFO[m] 
[[1;34mINFO[m] [1m--------------------< [0;36morg.zalando:catwatch-backend[0;1m >--------------------[m
[[1;34mINFO[m] [1mBuilding catwatch-backend 0.0.1-SNAPSHOT[m
[[1;34mINFO[m] [1m--------------------------------[ jar ]---------------------------------[m
[[1;34mINFO[m] 
[[1;34mINFO[m] [1m--- [0;32mmaven-clean-plugin:2.5:clean[m [1m(default-clean)[m @ [36mcatwatch-backend[0;1m ---[m
[[1;34mINFO[m] Deleting /media/rincon/63999417195/eclipse-workspace/EMB-master/jdk_8_maven/cs/rest/original/catwatch/catwatch-backend/target
[[1;34mINFO[m] 
[[1;34mINFO[m] [1m--- [0;32mjacoco-maven-plugin:0.8.7:prepare-agent[m [1m(prepare-agent)[m @ [36mcatwatch-backend[0;1m ---[m
[[1;34mINFO[m] argLine set to -javaagent:/home/rincon/.m2/repository/org/jacoco/org.jacoco.agent/0.8.7/org.jacoco.agent-0.8.7-runtime.jar=destfile=/media/rincon/63999417195/eclipse-workspace/EMB-master/jdk_8_maven/cs/rest/original/catwatch/catwatch-backend/target/jacoco.exec
[[1;34mINFO[m] 
[[1;34mINFO[m] [1m--- [0;32mjacoco-maven-plugin:0.8.7:prepare-agent[m [1m(default)[m @ [36mcatwatch-backend[0;1m ---[m
[[1;34mINFO[m] argLine set to -javaagent:/home/rincon/.m2/repository/org/jacoco/org.jacoco.agent/0.8.7/org.jacoco.agent-0.8.7-runtime.jar=destfile=/media/rincon/63999417195/eclipse-workspace/EMB-master/jdk_8_maven/cs/rest/original/catwatch/catwatch-backend/target/jacoco.exec
[[1;34mINFO[m] 
[[1;34mINFO[m] [1m--- [0;32mapt-maven-plugin:1.1.3:process[m [1m(default)[m @ [36mcatwatch-backend[0;1m ---[m
[[1;34mINFO[m] 
[[1;34mINFO[m] [1m--- [0;32mspring-boot-maven-plugin:1.5.4.RELEASE:build-info[m [1m(default)[m @ [36mcatwatch-backend[0;1m ---[m
[[1;34mINFO[m] 
[[1;34mINFO[m] [1m--- [0;32mmaven-resources-plugin:2.6:resources[m [1m(default-resources)[m @ [36mcatwatch-backend[0;1m ---[m
[[1;34mINFO[m] Using 'UTF-8' encoding to copy filtered resources.
[[1;34mINFO[m] Copying 14 resources
[[1;34mINFO[m] 
[[1;34mINFO[m] [1m--- [0;32mmaven-compiler-plugin:3.8.0:compile[m [1m(default-compile)[m @ [36mcatwatch-backend[0;1m ---[m
[[1;34mINFO[m] Changes detected - recompiling the module!
[[1;34mINFO[m] Compiling 74 source files to /media/rincon/63999417195/eclipse-workspace/EMB-master/jdk_8_maven/cs/rest/original/catwatch/catwatch-backend/target/classes
[[1;34mINFO[m] 
[[1;34mINFO[m] [1m--- [0;32mjacoco-maven-plugin:0.8.7:prepare-agent[m [1m(prepare-agent)[m @ [36mcatwatch-backend[0;1m ---[m
[[1;34mINFO[m] argLine set to -javaagent:/home/rincon/.m2/repository/org/jacoco/org.jacoco.agent/0.8.7/org.jacoco.agent-0.8.7-runtime.jar=destfile=/media/rincon/63999417195/eclipse-workspace/EMB-master/jdk_8_maven/cs/rest/original/catwatch/catwatch-backend/target/jacoco.exec
[[1;34mINFO[m] 
[[1;34mINFO[m] [1m--- [0;32mjacoco-maven-plugin:0.8.7:prepare-agent[m [1m(default)[m @ [36mcatwatch-backend[0;1m ---[m
[[1;34mINFO[m] argLine set to -javaagent:/home/rincon/.m2/repository/org/jacoco/org.jacoco.agent/0.8.7/org.jacoco.agent-0.8.7-runtime.jar=destfile=/media/rincon/63999417195/eclipse-workspace/EMB-master/jdk_8_maven/cs/rest/original/catwatch/catwatch-backend/target/jacoco.exec
[[1;34mINFO[m] 
[[1;34mINFO[m] [1m--- [0;32mapt-maven-plugin:1.1.3:process[m [1m(default)[m @ [36mcatwatch-backend[0;1m ---[m
[[1;34mINFO[m] 
[[1;34mINFO[m] [1m--- [0;32mspring-boot-maven-plugin:1.5.4.RELEASE:build-info[m [1m(default)[m @ [36mcatwatch-backend[0;1m ---[m
[[1;34mINFO[m] 
[[1;34mINFO[m] [1m--- [0;32mmaven-resources-plugin:2.6:resources[m [1m(default-resources)[m @ [36mcatwatch-backend[0;1m ---[m
[[1;34mINFO[m] Using 'UTF-8' encoding to copy filtered resources.
[[1;34mINFO[m] Copying 14 resources
[[1;34mINFO[m] 
[[1;34mINFO[m] [1m--- [0;32mmaven-compiler-plugin:3.8.0:compile[m [1m(default-compile)[m @ [36mcatwatch-backend[0;1m ---[m
[[1;34mINFO[m] Nothing to compile - all classes are up to date
[[1;34mINFO[m] 
[[1;34mINFO[m] [1m--- [0;32mmaven-resources-plugin:2.6:testResources[m [1m(default-testResources)[m @ [36mcatwatch-backend[0;1m ---[m
[[1;34mINFO[m] Using 'UTF-8' encoding to copy filtered resources.
[[1;34mINFO[m] skip non existing resourceDirectory /media/rincon/63999417195/eclipse-workspace/EMB-master/jdk_8_maven/cs/rest/original/catwatch/catwatch-backend/src/test/resources
[[1;34mINFO[m] 
[[1;34mINFO[m] [1m--- [0;32mmaven-compiler-plugin:3.8.0:testCompile[m [1m(default-testCompile)[m @ [36mcatwatch-backend[0;1m ---[m
[[1;34mINFO[m] Changes detected - recompiling the module!
[[1;34mINFO[m] Compiling 1 source file to /media/rincon/63999417195/eclipse-workspace/EMB-master/jdk_8_maven/cs/rest/original/catwatch/catwatch-backend/target/test-classes
[[1;34mINFO[m] /media/rincon/63999417195/eclipse-workspace/EMB-master/jdk_8_maven/cs/rest/original/catwatch/catwatch-backend/src/test/java/org/zalando/catwatch/backend/gpt4o_run01_ProjectServiceImplTest.java: /media/rincon/63999417195/eclipse-workspace/EMB-master/jdk_8_maven/cs/rest/original/catwatch/catwatch-backend/src/test/java/org/zalando/catwatch/backend/gpt4o_run01_ProjectServiceImplTest.java uses unchecked or unsafe operations.
[[1;34mINFO[m] /media/rincon/63999417195/eclipse-workspace/EMB-master/jdk_8_maven/cs/rest/original/catwatch/catwatch-backend/src/test/java/org/zalando/catwatch/backend/gpt4o_run01_ProjectServiceImplTest.java: Recompile with -Xlint:unchecked for details.
[[1;34mINFO[m] 
[[1;34mINFO[m] [1m--- [0;32mjacoco-maven-plugin:0.8.7:prepare-agent[m [1m(prepare-agent)[m @ [36mcatwatch-backend[0;1m ---[m
[[1;34mINFO[m] argLine set to -javaagent:/home/rincon/.m2/repository/org/jacoco/org.jacoco.agent/0.8.7/org.jacoco.agent-0.8.7-runtime.jar=destfile=/media/rincon/63999417195/eclipse-workspace/EMB-master/jdk_8_maven/cs/rest/original/catwatch/catwatch-backend/target/jacoco.exec
[[1;34mINFO[m] 
[[1;34mINFO[m] [1m--- [0;32mjacoco-maven-plugin:0.8.7:prepare-agent[m [1m(default)[m @ [36mcatwatch-backend[0;1m ---[m
[[1;34mINFO[m] argLine set to -javaagent:/home/rincon/.m2/repository/org/jacoco/org.jacoco.agent/0.8.7/org.jacoco.agent-0.8.7-runtime.jar=destfile=/media/rincon/63999417195/eclipse-workspace/EMB-master/jdk_8_maven/cs/rest/original/catwatch/catwatch-backend/target/jacoco.exec
[[1;34mINFO[m] 
[[1;34mINFO[m] [1m--- [0;32mapt-maven-plugin:1.1.3:process[m [1m(default)[m @ [36mcatwatch-backend[0;1m ---[m
[[1;34mINFO[m] 
[[1;34mINFO[m] [1m--- [0;32mspring-boot-maven-plugin:1.5.4.RELEASE:build-info[m [1m(default)[m @ [36mcatwatch-backend[0;1m ---[m
[[1;34mINFO[m] 
[[1;34mINFO[m] [1m--- [0;32mmaven-resources-plugin:2.6:resources[m [1m(default-resources)[m @ [36mcatwatch-backend[0;1m ---[m
[[1;34mINFO[m] Using 'UTF-8' encoding to copy filtered resources.
[[1;34mINFO[m] Copying 14 resources
[[1;34mINFO[m] 
[[1;34mINFO[m] [1m--- [0;32mmaven-compiler-plugin:3.8.0:compile[m [1m(default-compile)[m @ [36mcatwatch-backend[0;1m ---[m
[[1;34mINFO[m] Changes detected - recompiling the module!
[[1;34mINFO[m] Compiling 74 source files to /media/rincon/63999417195/eclipse-workspace/EMB-master/jdk_8_maven/cs/rest/original/catwatch/catwatch-backend/target/classes
[[1;34mINFO[m] 
[[1;34mINFO[m] [1m--- [0;32mmaven-resources-plugin:2.6:testResources[m [1m(default-testResources)[m @ [36mcatwatch-backend[0;1m ---[m
[[1;34mINFO[m] Using 'UTF-8' encoding to copy filtered resources.
[[1;34mINFO[m] skip non existing resourceDirectory /media/rincon/63999417195/eclipse-workspace/EMB-master/jdk_8_maven/cs/rest/original/catwatch/catwatch-backend/src/test/resources
[[1;34mINFO[m] 
[[1;34mINFO[m] [1m--- [0;32mmaven-compiler-plugin:3.8.0:testCompile[m [1m(default-testCompile)[m @ [36mcatwatch-backend[0;1m ---[m
[[1;34mINFO[m] Nothing to compile - all classes are up to date
[[1;34mINFO[m] 
[[1;34mINFO[m] [1m--- [0;32mmaven-surefire-plugin:2.22.0:test[m [1m(default-test)[m @ [36mcatwatch-backend[0;1m ---[m
[[1;34mINFO[m] 
[[1;34mINFO[m] -------------------------------------------------------
[[1;34mINFO[m]  T E S T S
[[1;34mINFO[m] -------------------------------------------------------
[[1;34mINFO[m] Running org.zalando.catwatch.backend.[1mgpt4o_run01_ProjectServiceImplTest[m

  .   ____          _            __ _ _
 /\\ / ___'_ __ _ _(_)_ __  __ _ \ \ \ \
( ( )\___ | '_ | '_| | '_ \/ _` | \ \ \ \
 \\/  ___)| |_)| | | | | || (_| |  ) ) ) )
  '  |____| .__|_| |_|_| |_\__, | / / / /
 =========|_|==============|___/=/_/_/_/
 :: Spring Boot ::        (v1.5.4.RELEASE)

12:05:05.367 [main] INFO  o.a.m.surefire.booter.ForkedBooter - Starting ForkedBooter v2.22.0 on IFTO-PROBOOK with PID 12150 (started by rincon in /media/rincon/63999417195/eclipse-workspace/EMB-master/jdk_8_maven/cs/rest/original/catwatch/catwatch-backend)
12:05:05.382 [main] INFO  o.a.m.surefire.booter.ForkedBooter - No active profile set, falling back to default profiles: default
12:05:06.021 [background-preinit] INFO  o.h.validator.internal.util.Version - HV000001: Hibernate Validator 5.3.5.Final
12:05:06.048 [main] INFO  o.s.b.c.e.AnnotationConfigEmbeddedWebApplicationContext - Refreshing org.springframework.boot.context.embedded.AnnotationConfigEmbeddedWebApplicationContext@70fede7d: startup date [Wed Apr 16 12:05:06 BRT 2025]; root of context hierarchy
12:05:08.273 [main] INFO  o.s.b.f.a.AutowiredAnnotationBeanPostProcessor - JSR-330 'javax.inject.Inject' annotation found and supported for autowiring
12:05:08.677 [main] INFO  o.s.c.s.PostProcessorRegistrationDelegate$BeanPostProcessorChecker - Bean 'org.springframework.retry.annotation.RetryConfiguration' of type [org.springframework.retry.annotation.RetryConfiguration$$EnhancerBySpringCGLIB$$57eb736c] is not eligible for getting processed by all BeanPostProcessors (for example: not eligible for auto-proxying)
12:05:08.735 [main] INFO  o.s.c.s.PostProcessorRegistrationDelegate$BeanPostProcessorChecker - Bean 'org.springframework.transaction.annotation.ProxyTransactionManagementConfiguration' of type [org.springframework.transaction.annotation.ProxyTransactionManagementConfiguration$$EnhancerBySpringCGLIB$$6227db47] is not eligible for getting processed by all BeanPostProcessors (for example: not eligible for auto-proxying)
12:05:09.287 [main] INFO  o.s.b.c.e.t.TomcatEmbeddedServletContainer - Tomcat initialized with port(s): 0 (http)
12:05:09.306 [main] INFO  o.a.catalina.core.StandardService - Starting service [Tomcat]
12:05:09.308 [main] INFO  o.a.catalina.core.StandardEngine - Starting Servlet Engine: Apache Tomcat/8.5.15
12:05:09.448 [localhost-startStop-1] INFO  o.a.c.c.C.[Tomcat].[localhost].[/] - Initializing Spring embedded WebApplicationContext
12:05:09.448 [localhost-startStop-1] INFO  o.s.web.context.ContextLoader - Root WebApplicationContext: initialization completed in 3404 ms
12:05:09.732 [localhost-startStop-1] INFO  o.s.b.w.s.FilterRegistrationBean - Mapping filter: 'metricsFilter' to: [/*]
12:05:09.732 [localhost-startStop-1] INFO  o.s.b.w.s.FilterRegistrationBean - Mapping filter: 'characterEncodingFilter' to: [/*]
12:05:09.732 [localhost-startStop-1] INFO  o.s.b.w.s.FilterRegistrationBean - Mapping filter: 'hiddenHttpMethodFilter' to: [/*]
12:05:09.733 [localhost-startStop-1] INFO  o.s.b.w.s.FilterRegistrationBean - Mapping filter: 'httpPutFormContentFilter' to: [/*]
12:05:09.733 [localhost-startStop-1] INFO  o.s.b.w.s.FilterRegistrationBean - Mapping filter: 'requestContextFilter' to: [/*]
12:05:09.734 [localhost-startStop-1] INFO  o.s.b.w.s.DelegatingFilterProxyRegistrationBean - Mapping filter: 'springSecurityFilterChain' to: [/*]
12:05:09.735 [localhost-startStop-1] INFO  o.s.b.w.s.FilterRegistrationBean - Mapping filter: 'webRequestLoggingFilter' to: [/*]
12:05:09.735 [localhost-startStop-1] INFO  o.s.b.w.s.FilterRegistrationBean - Mapping filter: 'corsFilter' to: [/*]
12:05:09.735 [localhost-startStop-1] INFO  o.s.b.w.s.FilterRegistrationBean - Mapping filter: 'applicationContextIdFilter' to: [/*]
12:05:09.735 [localhost-startStop-1] INFO  o.s.b.w.s.ServletRegistrationBean - Mapping servlet: 'dispatcherServlet' to [/]
12:05:10.410 [main] INFO  o.f.c.internal.util.VersionPrinter - Flyway 3.2.1 by Boxfuse
12:05:10.419 [main] INFO  o.f.c.i.dbsupport.DbSupportFactory - Database: jdbc:h2:mem:testdb (H2 1.4)
12:05:10.457 [main] INFO  o.f.core.internal.command.DbValidate - Validated 6 migrations (execution time 00:00.013s)
12:05:10.476 [main] INFO  o.f.c.i.m.MetaDataTableImpl - Creating Metadata table: "PUBLIC"."schema_version"
12:05:10.502 [main] INFO  o.f.core.internal.command.DbMigrate - Current version of schema "PUBLIC": << Empty Schema >>
12:05:10.502 [main] INFO  o.f.core.internal.command.DbMigrate - Migrating schema "PUBLIC" to version 001 - base version
12:05:10.528 [main] INFO  o.f.core.internal.command.DbMigrate - Migrating schema "PUBLIC" to version 002 - test baseline on migrate
12:05:10.535 [main] INFO  o.f.core.internal.command.DbMigrate - Migrating schema "PUBLIC" to version 003 - change varchar to text
12:05:10.620 [main] INFO  o.f.core.internal.command.DbMigrate - Migrating schema "PUBLIC" to version 004 - maintainers
12:05:10.629 [main] INFO  o.f.core.internal.command.DbMigrate - Migrating schema "PUBLIC" to version 005 - catwatch yaml
12:05:10.646 [main] INFO  o.f.core.internal.command.DbMigrate - Migrating schema "PUBLIC" to version 006 - add external contributors
12:05:10.661 [main] INFO  o.f.core.internal.command.DbMigrate - Successfully applied 6 migrations to schema "PUBLIC" (execution time 00:00.187s).
12:05:10.789 [main] INFO  o.s.o.j.LocalContainerEntityManagerFactoryBean - Building JPA container EntityManagerFactory for persistence unit 'default'
12:05:10.820 [main] INFO  o.h.jpa.internal.util.LogHelper - HHH000204: Processing PersistenceUnitInfo [
	name: default
	...]
12:05:10.928 [main] INFO  org.hibernate.Version - HHH000412: Hibernate Core {5.0.12.Final}
12:05:10.930 [main] INFO  org.hibernate.cfg.Environment - HHH000206: hibernate.properties not found
12:05:10.932 [main] INFO  org.hibernate.cfg.Environment - HHH000021: Bytecode provider name : javassist
12:05:10.984 [main] INFO  o.h.annotations.common.Version - HCANN000001: Hibernate Commons Annotations {5.0.1.Final}
12:05:11.135 [main] INFO  org.hibernate.dialect.Dialect - HHH000400: Using dialect: org.hibernate.dialect.H2Dialect
12:05:11.450 [main] WARN  org.hibernate.mapping.RootClass - HHH000038: Composite-id class does not override equals(): org.zalando.catwatch.backend.model.StatisticsKey
12:05:11.450 [main] WARN  org.hibernate.mapping.RootClass - HHH000039: Composite-id class does not override hashCode(): org.zalando.catwatch.backend.model.StatisticsKey
12:05:11.450 [main] WARN  org.hibernate.mapping.RootClass - HHH000038: Composite-id class does not override equals(): org.zalando.catwatch.backend.model.ContributorKey
12:05:11.450 [main] WARN  org.hibernate.mapping.RootClass - HHH000039: Composite-id class does not override hashCode(): org.zalando.catwatch.backend.model.ContributorKey
12:05:11.730 [main] INFO  o.h.tool.hbm2ddl.SchemaUpdate - HHH000228: Running hbm2ddl schema update
12:05:11.853 [main] INFO  o.s.o.j.LocalContainerEntityManagerFactoryBean - Initialized JPA EntityManagerFactory for persistence unit 'default'
12:05:11.908 [main] INFO  o.z.c.b.github.SnapshotProvider - Cache directory 'target/cache' is not found. Creating new directory.
12:05:11.908 [main] INFO  o.z.c.b.github.SnapshotProvider - Cache directory created successfully.
12:05:11.922 [main] INFO  o.z.c.b.github.SnapshotProvider - Initialized http client with 50 mb cache.
12:05:12.514 [main] INFO  o.h.h.i.QueryTranslatorFactoryInitiator - HHH000397: Using ASTQueryTranslatorFactory
12:05:13.465 [main] INFO  o.s.w.s.m.m.a.RequestMappingHandlerMapping - Mapped "{[/contributors],methods=[GET],produces=[application/json]}" onto public java.util.List<org.zalando.catwatch.backend.model.Contributor> org.zalando.catwatch.backend.web.ContributorsApi.contributorsGet(java.lang.String,java.lang.Integer,java.lang.Integer,java.lang.String,java.lang.String,java.lang.String,java.lang.String)
12:05:13.468 [main] INFO  o.s.w.s.m.m.a.RequestMappingHandlerMapping - Mapped "{[/languages],methods=[GET],produces=[application/json]}" onto public org.springframework.http.ResponseEntity<java.util.Collection<org.zalando.catwatch.backend.model.Language>> org.zalando.catwatch.backend.web.LanguagesApi.languagesGet(java.lang.String,java.lang.Integer,java.lang.Integer,java.lang.String)
12:05:13.469 [main] INFO  o.s.w.s.m.m.a.RequestMappingHandlerMapping - Mapped "{[/projects],methods=[GET],produces=[application/json]}" onto public org.springframework.http.ResponseEntity<java.util.Collection<org.zalando.catwatch.backend.model.Project>> org.zalando.catwatch.backend.web.ProjectsApi.projectsGet(java.lang.String,java.lang.Integer,java.lang.Integer,java.util.Date,java.util.Date,java.lang.String,java.lang.String,java.lang.String)
12:05:13.473 [main] INFO  o.s.w.s.m.m.a.RequestMappingHandlerMapping - Mapped "{[/statistics/projects],methods=[GET],produces=[application/json]}" onto public org.springframework.http.ResponseEntity<java.util.Collection<org.zalando.catwatch.backend.util.ProjectStats>> org.zalando.catwatch.backend.web.StatisticsApi.statisticsProjectGet(java.lang.String,java.lang.String,java.lang.String) throws java.text.ParseException
12:05:13.474 [main] INFO  o.s.w.s.m.m.a.RequestMappingHandlerMapping - Mapped "{[/statistics/contributors],methods=[GET],produces=[application/json]}" onto public org.springframework.http.ResponseEntity<java.util.Collection<org.zalando.catwatch.backend.util.ContributorStats>> org.zalando.catwatch.backend.web.StatisticsApi.statisticsContributorGet(java.lang.String,java.lang.String,java.lang.String) throws java.text.ParseException
12:05:13.474 [main] INFO  o.s.w.s.m.m.a.RequestMappingHandlerMapping - Mapped "{[/statistics/languages],methods=[GET],produces=[application/json]}" onto public org.springframework.http.ResponseEntity<java.util.Collection<org.zalando.catwatch.backend.util.LanguageStats>> org.zalando.catwatch.backend.web.StatisticsApi.statisticsLanguagesGet(java.lang.String,java.lang.String,java.lang.String)
12:05:13.475 [main] INFO  o.s.w.s.m.m.a.RequestMappingHandlerMapping - Mapped "{[/statistics],methods=[GET],produces=[application/json]}" onto public org.springframework.http.ResponseEntity<java.util.Collection<org.zalando.catwatch.backend.model.Statistics>> org.zalando.catwatch.backend.web.StatisticsApi.statisticsGet(java.lang.String,java.lang.String,java.lang.String)
12:05:13.477 [main] INFO  o.s.w.s.m.m.a.RequestMappingHandlerMapping - Mapped "{[/delete],methods=[GET],produces=[application/json;charset=utf-8]}" onto public java.lang.String org.zalando.catwatch.backend.web.admin.AdminController.deleteAll()
12:05:13.478 [main] INFO  o.s.w.s.m.m.a.RequestMappingHandlerMapping - Mapped "{[/config/scoring.project],methods=[POST],produces=[application/json;charset=utf-8]}" onto public java.util.List<java.lang.String> org.zalando.catwatch.backend.web.admin.AdminController.configScoringProjects(java.lang.String,java.lang.String)
12:05:13.479 [main] INFO  o.s.w.s.m.m.a.RequestMappingHandlerMapping - Mapped "{[/export],methods=[GET],produces=[application/json;charset=utf-8]}" onto public org.zalando.catwatch.backend.web.admin.DatabaseDto org.zalando.catwatch.backend.web.admin.AdminController.exportJson()
12:05:13.479 [main] INFO  o.s.w.s.m.m.a.RequestMappingHandlerMapping - Mapped "{[/import],methods=[POST],produces=[application/json;charset=utf-8]}" onto public java.lang.String org.zalando.catwatch.backend.web.admin.AdminController.importJson(org.zalando.catwatch.backend.web.admin.DatabaseDto)
12:05:13.480 [main] INFO  o.s.w.s.m.m.a.RequestMappingHandlerMapping - Mapped "{[/init],methods=[GET],produces=[application/json;charset=utf-8]}" onto public java.lang.String org.zalando.catwatch.backend.web.admin.AdminController.init()
12:05:13.480 [main] INFO  o.s.w.s.m.m.a.RequestMappingHandlerMapping - Mapped "{[/config],methods=[GET],produces=[application/json]}" onto public java.util.Map<java.lang.String, java.lang.String> org.zalando.catwatch.backend.web.config.ConfigController.config() throws java.lang.Exception
12:05:13.482 [main] INFO  o.s.w.s.m.m.a.RequestMappingHandlerMapping - Mapped "{[/fetch],methods=[GET],produces=[application/json;charset=utf-8]}" onto public java.lang.String org.zalando.catwatch.backend.web.fetch.FetchController.fetch() throws java.lang.Exception
12:05:13.487 [main] INFO  o.s.w.s.m.m.a.RequestMappingHandlerMapping - Mapped "{[/swagger-resources]}" onto public org.springframework.http.ResponseEntity<java.util.List<springfox.documentation.swagger.web.SwaggerResource>> springfox.documentation.swagger.web.ApiResourceController.swaggerResources()
12:05:13.489 [main] INFO  o.s.w.s.m.m.a.RequestMappingHandlerMapping - Mapped "{[/swagger-resources/configuration/security]}" onto public org.springframework.http.ResponseEntity<springfox.documentation.swagger.web.SecurityConfiguration> springfox.documentation.swagger.web.ApiResourceController.securityConfiguration()
12:05:13.490 [main] INFO  o.s.w.s.m.m.a.RequestMappingHandlerMapping - Mapped "{[/swagger-resources/configuration/ui]}" onto public org.springframework.http.ResponseEntity<springfox.documentation.swagger.web.UiConfiguration> springfox.documentation.swagger.web.ApiResourceController.uiConfiguration()
12:05:13.494 [main] INFO  o.s.w.s.m.m.a.RequestMappingHandlerMapping - Mapped "{[/error],produces=[text/html]}" onto public org.springframework.web.servlet.ModelAndView org.springframework.boot.autoconfigure.web.BasicErrorController.errorHtml(javax.servlet.http.HttpServletRequest,javax.servlet.http.HttpServletResponse)
12:05:13.494 [main] INFO  o.s.w.s.m.m.a.RequestMappingHandlerMapping - Mapped "{[/error]}" onto public org.springframework.http.ResponseEntity<java.util.Map<java.lang.String, java.lang.Object>> org.springframework.boot.autoconfigure.web.BasicErrorController.error(javax.servlet.http.HttpServletRequest)
12:05:13.828 [main] INFO  o.s.b.a.e.mvc.EndpointHandlerMapping - Mapped "{[/health || /health.json],methods=[GET],produces=[application/vnd.spring-boot.actuator.v1+json || application/json]}" onto public java.lang.Object org.springframework.boot.actuate.endpoint.mvc.HealthMvcEndpoint.invoke(javax.servlet.http.HttpServletRequest,java.security.Principal)
12:05:14.154 [main] INFO  o.s.b.a.s.AuthenticationManagerConfiguration - 

Using default security password: 5ca816f0-439c-4bf1-8f74-52795c26641f

12:05:14.518 [main] INFO  o.s.s.web.DefaultSecurityFilterChain - Creating filter chain: org.springframework.security.web.util.matcher.AnyRequestMatcher@1, [org.springframework.security.web.context.request.async.WebAsyncManagerIntegrationFilter@7a247d04, org.springframework.security.web.context.SecurityContextPersistenceFilter@2f8d74ed, org.springframework.security.web.header.HeaderWriterFilter@566b95a, org.springframework.security.web.authentication.logout.LogoutFilter@696f9548, org.springframework.security.oauth2.provider.authentication.OAuth2AuthenticationProcessingFilter@4de607e9, org.springframework.security.web.savedrequest.RequestCacheAwareFilter@28131d33, org.springframework.security.web.servletapi.SecurityContextHolderAwareRequestFilter@1cc05811, org.springframework.security.web.authentication.AnonymousAuthenticationFilter@40d9bb03, org.springframework.security.web.session.SessionManagementFilter@7beaaff8, org.springframework.security.web.access.ExceptionTranslationFilter@2da99ea9, org.springframework.security.web.access.intercept.FilterSecurityInterceptor@10a8f7c3]
12:05:14.539 [main] INFO  o.s.s.web.DefaultSecurityFilterChain - Creating filter chain: org.springframework.boot.actuate.autoconfigure.ManagementWebSecurityAutoConfiguration$LazyEndpointPathRequestMatcher@37c2724d, [org.springframework.security.web.context.request.async.WebAsyncManagerIntegrationFilter@14d235d0, org.springframework.security.web.context.SecurityContextPersistenceFilter@4fb7030f, org.springframework.security.web.header.HeaderWriterFilter@1cb7e07f, org.springframework.security.web.authentication.logout.LogoutFilter@ca80fb4, org.springframework.security.web.authentication.www.BasicAuthenticationFilter@7db67ae9, org.springframework.security.web.savedrequest.RequestCacheAwareFilter@36d01acb, org.springframework.security.web.servletapi.SecurityContextHolderAwareRequestFilter@1547a076, org.springframework.security.web.authentication.AnonymousAuthenticationFilter@5afd7491, org.springframework.security.web.session.SessionManagementFilter@16d79a7d, org.springframework.security.web.access.ExceptionTranslationFilter@22eb6ebc, org.springframework.security.web.access.intercept.FilterSecurityInterceptor@25ac1d14]
12:05:14.599 [main] INFO  s.d.s.w.PropertySourcedRequestMappingHandlerMapping - Mapped URL path [/v2/api-docs] onto method [public org.springframework.http.ResponseEntity<springfox.documentation.spring.web.json.Json> springfox.documentation.swagger2.web.Swagger2Controller.getDocumentation(java.lang.String,javax.servlet.http.HttpServletRequest)]
12:05:14.927 [main] INFO  o.s.w.s.m.m.a.RequestMappingHandlerAdapter - Looking for @ControllerAdvice: org.springframework.boot.context.embedded.AnnotationConfigEmbeddedWebApplicationContext@70fede7d: startup date [Wed Apr 16 12:05:06 BRT 2025]; root of context hierarchy
12:05:15.031 [main] INFO  o.s.w.s.h.SimpleUrlHandlerMapping - Mapped URL path [/webjars/**] onto handler of type [class org.springframework.web.servlet.resource.ResourceHttpRequestHandler]
12:05:15.032 [main] INFO  o.s.w.s.h.SimpleUrlHandlerMapping - Mapped URL path [/**] onto handler of type [class org.springframework.web.servlet.resource.ResourceHttpRequestHandler]
12:05:15.093 [main] INFO  o.s.w.s.h.SimpleUrlHandlerMapping - Mapped URL path [/**/favicon.ico] onto handler of type [class org.springframework.web.servlet.resource.ResourceHttpRequestHandler]
12:05:15.126 [main] INFO  o.s.b.a.w.WebMvcAutoConfiguration$WelcomePageHandlerMapping - Adding welcome page: class path resource [static/index.html]
12:05:15.482 [main] INFO  o.s.j.e.a.AnnotationMBeanExporter - Registering beans for JMX exposure on startup
12:05:15.488 [main] INFO  o.s.b.a.e.jmx.EndpointMBeanExporter - Registering beans for JMX exposure on startup
12:05:15.494 [main] INFO  o.s.c.s.DefaultLifecycleProcessor - Starting beans in phase 0
12:05:15.505 [main] INFO  o.s.b.a.e.jmx.EndpointMBeanExporter - Located managed bean 'healthEndpoint': registering with JMX server as MBean [org.springframework.boot:type=Endpoint,name=healthEndpoint]
12:05:15.522 [main] INFO  o.s.c.s.DefaultLifecycleProcessor - Starting beans in phase 2147483647
12:05:15.523 [main] INFO  s.d.s.w.p.DocumentationPluginsBootstrapper - Context refreshed
12:05:15.549 [main] INFO  s.d.s.w.p.DocumentationPluginsBootstrapper - Found 1 custom documentation plugin(s)
12:05:15.590 [main] INFO  s.d.s.w.s.ApiListingReferenceScanner - Scanning for api listing references
12:05:15.909 [main] INFO  s.d.s.w.r.o.CachingOperationNameGenerator - Generating unique operation named: invokeUsingGET_1
12:05:15.992 [main] INFO  o.s.s.a.ScheduledAnnotationBeanPostProcessor - No TaskScheduler/ScheduledExecutorService bean found for scheduled processing
12:05:16.008 [main] INFO  o.a.coyote.http11.Http11NioProtocol - Initializing ProtocolHandler ["http-nio-auto-1"]
12:05:16.027 [main] INFO  o.a.coyote.http11.Http11NioProtocol - Starting ProtocolHandler ["http-nio-auto-1"]
12:05:16.034 [main] INFO  o.a.tomcat.util.net.NioSelectorPool - Using a shared selector for servlet write/read
12:05:16.058 [main] INFO  o.s.b.c.e.t.TomcatEmbeddedServletContainer - Tomcat started on port(s): 38397 (http)
12:05:16.066 [main] INFO  o.a.m.surefire.booter.ForkedBooter - Started ForkedBooter in 11.192 seconds (JVM running for 12.291)
12:05:16.596 [main] INFO  o.s.c.s.DefaultLifecycleProcessor - Stopping beans in phase 2147483647
12:05:16.598 [main] INFO  o.s.c.s.DefaultLifecycleProcessor - Stopping beans in phase 0
[[1;31mERROR[m] [1;31mTests [0;1mrun: [0;1m7[m, [1;31mFailures: [0;1;31m1[m, [1;31mErrors: [0;1;31m3[m, Skipped: 0, Time elapsed: 12.264 s[1;31m <<< FAILURE![m - in org.zalando.catwatch.backend.[1mgpt4o_run01_ProjectServiceImplTest[m
[[1;31mERROR[m] testFindProjects(org.zalando.catwatch.backend.gpt4o_run01_ProjectServiceImplTest)  Time elapsed: 0.034 s  <<< ERROR!
java.lang.NullPointerException
	at org.zalando.catwatch.backend.gpt4o_run01_ProjectServiceImplTest.testFindProjects(gpt4o_run01_ProjectServiceImplTest.java:72)

[[1;31mERROR[m] testGetMergedProjectList(org.zalando.catwatch.backend.gpt4o_run01_ProjectServiceImplTest)  Time elapsed: 0.003 s  <<< ERROR!
java.lang.reflect.InvocationTargetException
	at org.zalando.catwatch.backend.gpt4o_run01_ProjectServiceImplTest.testGetMergedProjectList(gpt4o_run01_ProjectServiceImplTest.java:95)
Caused by: java.lang.NullPointerException
	at org.zalando.catwatch.backend.gpt4o_run01_ProjectServiceImplTest.testGetMergedProjectList(gpt4o_run01_ProjectServiceImplTest.java:95)

[[1;31mERROR[m] testCreateMergedProject(org.zalando.catwatch.backend.gpt4o_run01_ProjectServiceImplTest)  Time elapsed: 0.003 s  <<< FAILURE!
java.lang.AssertionError: expected:<25> but was:<5>
	at org.zalando.catwatch.backend.gpt4o_run01_ProjectServiceImplTest.testCreateMergedProject(gpt4o_run01_ProjectServiceImplTest.java:127)

[[1;31mERROR[m] testGetOrganizationConfig(org.zalando.catwatch.backend.gpt4o_run01_ProjectServiceImplTest)  Time elapsed: 0.003 s  <<< ERROR!
java.lang.reflect.InvocationTargetException
	at org.zalando.catwatch.backend.gpt4o_run01_ProjectServiceImplTest.testGetOrganizationConfig(gpt4o_run01_ProjectServiceImplTest.java:161)
Caused by: java.lang.NullPointerException
	at org.zalando.catwatch.backend.gpt4o_run01_ProjectServiceImplTest.testGetOrganizationConfig(gpt4o_run01_ProjectServiceImplTest.java:161)

12:05:16.637 [Thread-6] INFO  o.s.b.c.e.AnnotationConfigEmbeddedWebApplicationContext - Closing org.springframework.boot.context.embedded.AnnotationConfigEmbeddedWebApplicationContext@70fede7d: startup date [Wed Apr 16 12:05:06 BRT 2025]; root of context hierarchy
12:05:16.645 [Thread-6] INFO  o.s.c.s.DefaultLifecycleProcessor - Stopping beans in phase 2147483647
12:05:16.645 [Thread-6] INFO  o.s.c.s.DefaultLifecycleProcessor - Stopping beans in phase 0
12:05:16.646 [Thread-6] INFO  o.s.b.a.e.jmx.EndpointMBeanExporter - Unregistering JMX-exposed beans on shutdown
12:05:16.650 [Thread-6] INFO  o.s.b.a.e.jmx.EndpointMBeanExporter - Unregistering JMX-exposed beans
12:05:16.651 [Thread-6] INFO  o.s.j.e.a.AnnotationMBeanExporter - Unregistering JMX-exposed beans on shutdown
12:05:16.666 [Thread-6] INFO  o.s.o.j.LocalContainerEntityManagerFactoryBean - Closing JPA EntityManagerFactory for persistence unit 'default'
[[1;34mINFO[m] 
[[1;34mINFO[m] Results:
[[1;34mINFO[m] 
[[1;31mERROR[m] [1;31mFailures: [m
[[1;31mERROR[m] [1;31m  gpt4o_run01_ProjectServiceImplTest.testCreateMergedProject:127 expected:<25> but was:<5>[m
[[1;31mERROR[m] [1;31mErrors: [m
[[1;31mERROR[m] [1;31m  gpt4o_run01_ProjectServiceImplTest.testFindProjects:72 » NullPointer[m
[[1;31mERROR[m] [1;31m  gpt4o_run01_ProjectServiceImplTest.testGetMergedProjectList:95 » InvocationTarget[m
[[1;31mERROR[m] [1;31m  gpt4o_run01_ProjectServiceImplTest.testGetOrganizationConfig:161 » InvocationTarget[m
[[1;34mINFO[m] 
[[1;31mERROR[m] [1;31mTests run: 7, Failures: 1, Errors: 3, Skipped: 0[m
[[1;34mINFO[m] 
[[1;34mINFO[m] [1m------------------------------------------------------------------------[m
[[1;34mINFO[m] [1;31mBUILD FAILURE[m
[[1;34mINFO[m] [1m------------------------------------------------------------------------[m
[[1;34mINFO[m] Total time:  19.674 s
[[1;34mINFO[m] Finished at: 2025-04-16T12:05:17-03:00
[[1;34mINFO[m] [1m------------------------------------------------------------------------[m
[[1;31mERROR[m] Failed to execute goal [32morg.apache.maven.plugins:maven-surefire-plugin:2.22.0:test[m [1m(default-test)[m on project [36mcatwatch-backend[m: [1;31mThere are test failures.[m
[[1;31mERROR[m] [1;31m[m
[[1;31mERROR[m] [1;31mPlease refer to /media/rincon/63999417195/eclipse-workspace/EMB-master/jdk_8_maven/cs/rest/original/catwatch/catwatch-backend/target/surefire-reports for the individual test results.[m
[[1;31mERROR[m] [1;31mPlease refer to dump files (if any exist) [date]-jvmRun[N].dump, [date].dumpstream and [date]-jvmRun[N].dumpstream.[m
[[1;31mERROR[m] -> [1m[Help 1][m
[[1;31mERROR[m] 
[[1;31mERROR[m] To see the full stack trace of the errors, re-run Maven with the [1m-e[m switch.
[[1;31mERROR[m] Re-run Maven using the [1m-X[m switch to enable full debug logging.
[[1;31mERROR[m] 
[[1;31mERROR[m] For more information about the errors and possible solutions, please read the following articles:
[[1;31mERROR[m] [1m[Help 1][m http://cwiki.apache.org/confluence/display/MAVEN/MojoFailureException
