[[1;34mINFO[m] Scanning for projects...
[[1;33mWARNING[m] 
[[1;33mWARNING[m] Some problems were encountered while building the effective model for eu.fayder:restcountries:jar:2.0.6-SNAPSHOT
[[1;33mWARNING[m] 'dependencies.dependency.(groupId:artifactId:type:classifier)' must be unique: com.google.code.gson:gson:jar -> version ${gson.version} vs 2.8.9 @ line 111, column 21
[[1;33mWARNING[m] 
[[1;33mWARNING[m] It is highly recommended to fix these problems because they threaten the stability of your build.
[[1;33mWARNING[m] 
[[1;33mWARNING[m] For this reason, future Maven versions might no longer support building such malformed projects.
[[1;33mWARNING[m] 
[[1;34mINFO[m] 
[[1;34mINFO[m] [1m----------------------< [0;36meu.fayder:restcountries[0;1m >-----------------------[m
[[1;34mINFO[m] [1mBuilding restcountries 2.0.6-SNAPSHOT[m
[[1;34mINFO[m] [1m--------------------------------[ jar ]---------------------------------[m
[[1;34mINFO[m] 
[[1;34mINFO[m] [1m--- [0;32mmaven-clean-plugin:2.5:clean[m [1m(default-clean)[m @ [36mrestcountries[0;1m ---[m
[[1;34mINFO[m] Deleting /media/rincon/63999417195/eclipse-workspace/EMB-master/jdk_8_maven/cs/rest/original/restcountries/target
[[1;34mINFO[m] 
[[1;34mINFO[m] [1m--- [0;32mjacoco-maven-plugin:0.8.7:prepare-agent[m [1m(default)[m @ [36mrestcountries[0;1m ---[m
[[1;34mINFO[m] argLine set to -javaagent:/home/rincon/.m2/repository/org/jacoco/org.jacoco.agent/0.8.7/org.jacoco.agent-0.8.7-runtime.jar=destfile=/media/rincon/63999417195/eclipse-workspace/EMB-master/jdk_8_maven/cs/rest/original/restcountries/target/jacoco.exec
[[1;34mINFO[m] 
[[1;34mINFO[m] [1m--- [0;32mmaven-resources-plugin:2.6:resources[m [1m(default-resources)[m @ [36mrestcountries[0;1m ---[m
[[1;34mINFO[m] Using 'UTF-8' encoding to copy filtered resources.
[[1;34mINFO[m] Copying 6 resources
[[1;34mINFO[m] 
[[1;34mINFO[m] [1m--- [0;32mmaven-compiler-plugin:3.8.0:compile[m [1m(default-compile)[m @ [36mrestcountries[0;1m ---[m
[[1;34mINFO[m] Changes detected - recompiling the module!
[[1;34mINFO[m] Compiling 22 source files to /media/rincon/63999417195/eclipse-workspace/EMB-master/jdk_8_maven/cs/rest/original/restcountries/target/classes
[[1;34mINFO[m] /media/rincon/63999417195/eclipse-workspace/EMB-master/jdk_8_maven/cs/rest/original/restcountries/src/main/java/eu/fayder/restcountries/v2/rest/CountryRestV2.java: /media/rincon/63999417195/eclipse-workspace/EMB-master/jdk_8_maven/cs/rest/original/restcountries/src/main/java/eu/fayder/restcountries/v2/rest/CountryRestV2.java uses or overrides a deprecated API.
[[1;34mINFO[m] /media/rincon/63999417195/eclipse-workspace/EMB-master/jdk_8_maven/cs/rest/original/restcountries/src/main/java/eu/fayder/restcountries/v2/rest/CountryRestV2.java: Recompile with -Xlint:deprecation for details.
[[1;34mINFO[m] 
[[1;34mINFO[m] [1m--- [0;32mjacoco-maven-plugin:0.8.7:prepare-agent[m [1m(default)[m @ [36mrestcountries[0;1m ---[m
[[1;34mINFO[m] argLine set to -javaagent:/home/rincon/.m2/repository/org/jacoco/org.jacoco.agent/0.8.7/org.jacoco.agent-0.8.7-runtime.jar=destfile=/media/rincon/63999417195/eclipse-workspace/EMB-master/jdk_8_maven/cs/rest/original/restcountries/target/jacoco.exec
[[1;34mINFO[m] 
[[1;34mINFO[m] [1m--- [0;32mmaven-resources-plugin:2.6:resources[m [1m(default-resources)[m @ [36mrestcountries[0;1m ---[m
[[1;34mINFO[m] Using 'UTF-8' encoding to copy filtered resources.
[[1;34mINFO[m] Copying 6 resources
[[1;34mINFO[m] 
[[1;34mINFO[m] [1m--- [0;32mmaven-compiler-plugin:3.8.0:compile[m [1m(default-compile)[m @ [36mrestcountries[0;1m ---[m
[[1;34mINFO[m] Nothing to compile - all classes are up to date
[[1;34mINFO[m] 
[[1;34mINFO[m] [1m--- [0;32mmaven-resources-plugin:2.6:testResources[m [1m(default-testResources)[m @ [36mrestcountries[0;1m ---[m
[[1;34mINFO[m] Using 'UTF-8' encoding to copy filtered resources.
[[1;34mINFO[m] Copying 1 resource
[[1;34mINFO[m] 
[[1;34mINFO[m] [1m--- [0;32mmaven-compiler-plugin:3.8.0:testCompile[m [1m(default-testCompile)[m @ [36mrestcountries[0;1m ---[m
[[1;34mINFO[m] Changes detected - recompiling the module!
[[1;34mINFO[m] Compiling 1 source file to /media/rincon/63999417195/eclipse-workspace/EMB-master/jdk_8_maven/cs/rest/original/restcountries/target/test-classes
[[1;34mINFO[m] 
[[1;34mINFO[m] [1m--- [0;32mjacoco-maven-plugin:0.8.7:prepare-agent[m [1m(default)[m @ [36mrestcountries[0;1m ---[m
[[1;34mINFO[m] argLine set to -javaagent:/home/rincon/.m2/repository/org/jacoco/org.jacoco.agent/0.8.7/org.jacoco.agent-0.8.7-runtime.jar=destfile=/media/rincon/63999417195/eclipse-workspace/EMB-master/jdk_8_maven/cs/rest/original/restcountries/target/jacoco.exec
[[1;34mINFO[m] 
[[1;34mINFO[m] [1m--- [0;32mmaven-resources-plugin:2.6:resources[m [1m(default-resources)[m @ [36mrestcountries[0;1m ---[m
[[1;34mINFO[m] Using 'UTF-8' encoding to copy filtered resources.
[[1;34mINFO[m] Copying 6 resources
[[1;34mINFO[m] 
[[1;34mINFO[m] [1m--- [0;32mmaven-compiler-plugin:3.8.0:compile[m [1m(default-compile)[m @ [36mrestcountries[0;1m ---[m
[[1;34mINFO[m] Nothing to compile - all classes are up to date
[[1;34mINFO[m] 
[[1;34mINFO[m] [1m--- [0;32mmaven-resources-plugin:2.6:testResources[m [1m(default-testResources)[m @ [36mrestcountries[0;1m ---[m
[[1;34mINFO[m] Using 'UTF-8' encoding to copy filtered resources.
[[1;34mINFO[m] Copying 1 resource
[[1;34mINFO[m] 
[[1;34mINFO[m] [1m--- [0;32mmaven-compiler-plugin:3.8.0:testCompile[m [1m(default-testCompile)[m @ [36mrestcountries[0;1m ---[m
[[1;34mINFO[m] Nothing to compile - all classes are up to date
[[1;34mINFO[m] 
[[1;34mINFO[m] [1m--- [0;32mmaven-surefire-plugin:2.22.0:test[m [1m(default-test)[m @ [36mrestcountries[0;1m ---[m
[[1;34mINFO[m] 
[[1;34mINFO[m] -------------------------------------------------------
[[1;34mINFO[m]  T E S T S
[[1;34mINFO[m] -------------------------------------------------------
[[1;34mINFO[m] Running eu.fayder.restcountries.[1msonnet35_run01_StripeRestTest[m

  .   ____          _            __ _ _
 /\\ / ___'_ __ _ _(_)_ __  __ _ \ \ \ \
( ( )\___ | '_ | '_| | '_ \/ _` | \ \ \ \
 \\/  ___)| |_)| | | | | || (_| |  ) ) ) )
  '  |____| .__|_| |_|_| |_\__, | / / / /
 =========|_|==============|___/=/_/_/_/
 :: Spring Boot ::        (v2.3.2.RELEASE)

2025-03-26 19:42:22,417 INFO  [org.apache.maven.surefire.booter.ForkedBooter:55] Starting ForkedBooter v2.22.0 on IFTO-PROBOOK with PID 79832 (started by rincon in /media/rincon/63999417195/eclipse-workspace/EMB-master/jdk_8_maven/cs/rest/original/restcountries)
2025-03-26 19:42:22,423 INFO  [org.apache.maven.surefire.booter.ForkedBooter:651] No active profile set, falling back to default profiles: default
2025-03-26 19:42:24,187 INFO  [org.jboss.resteasy.springboot.ResteasyEmbeddedServletInitializer:74] Finding JAX-RS Application classes
2025-03-26 19:42:24,192 INFO  [org.jboss.resteasy.springboot.ResteasyEmbeddedServletInitializer:111] Property resteasy.jaxrs.app.registration has been set to property
2025-03-26 19:42:24,194 INFO  [org.jboss.resteasy.springboot.ResteasyEmbeddedServletInitializer:154] Property resteasy.jaxrs.app.classes has been set to eu.fayder.restcountries.servlet.RestApplication
2025-03-26 19:42:24,195 INFO  [org.jboss.resteasy.springboot.ResteasyEmbeddedServletInitializer:99] JAX-RS Application class found: eu.fayder.restcountries.servlet.RestApplication
2025-03-26 19:42:24,711 INFO  [org.springframework.boot.web.embedded.tomcat.TomcatWebServer:108] Tomcat initialized with port(s): 0 (http)
2025-03-26 19:42:24,904 INFO  [org.springframework.boot.web.servlet.context.ServletWebServerApplicationContext:285] Root WebApplicationContext: initialization completed in 2001 ms
2025-03-26 19:42:25,434 INFO  [org.springframework.scheduling.concurrent.ThreadPoolTaskExecutor:181] Initializing ExecutorService 'applicationTaskExecutor'
2025-03-26 19:42:25,658 INFO  [org.springframework.boot.autoconfigure.web.servlet.WelcomePageHandlerMapping:54] Adding welcome page: ServletContext resource [/index.html]
2025-03-26 19:42:26,658 INFO  [org.jboss.resteasy.resteasy_jaxrs.i18n:160] RESTEASY002225: Deploying javax.ws.rs.core.Application: class eu.fayder.restcountries.servlet.RestApplication
2025-03-26 19:42:26,658 INFO  [org.jboss.resteasy.resteasy_jaxrs.i18n:187] RESTEASY002220: Adding singleton resource eu.fayder.restcountries.v1.rest.CountryRestV1 from Application class eu.fayder.restcountries.servlet.RestApplication
2025-03-26 19:42:26,659 INFO  [org.jboss.resteasy.resteasy_jaxrs.i18n:187] RESTEASY002220: Adding singleton resource eu.fayder.restcountries.v2.rest.StripeRest from Application class eu.fayder.restcountries.servlet.RestApplication
2025-03-26 19:42:26,659 INFO  [org.jboss.resteasy.resteasy_jaxrs.i18n:187] RESTEASY002220: Adding singleton resource eu.fayder.restcountries.v2.rest.CountryRestV2 from Application class eu.fayder.restcountries.servlet.RestApplication
2025-03-26 19:42:26,717 INFO  [org.springframework.boot.web.embedded.tomcat.TomcatWebServer:220] Tomcat started on port(s): 44745 (http) with context path ''
2025-03-26 19:42:26,740 INFO  [org.apache.maven.surefire.booter.ForkedBooter:61] Started ForkedBooter in 5.177 seconds (JVM running for 6.218)
2025-03-26 19:42:28,157 INFO  [org.springframework.web.servlet.DispatcherServlet:525] Initializing Servlet 'dispatcherServlet'
2025-03-26 19:42:28,168 INFO  [org.springframework.web.servlet.DispatcherServlet:547] Completed initialization in 10 ms
Request method:	POST
Request URI:	http://localhost:44745/contribute
Proxy:			<none>
Request params:	<none>
Query params:	<none>
Form params:	<none>
Path params:	<none>
Headers:		Accept=*/*
				Content-Type=application/json;charset=utf-8
Cookies:		<none>
Multiparts:		<none>
Body:
{
    "token": null,
    "amount": 1000
}

HTTP/1.1 404 
Vary: Origin
Vary: Access-Control-Request-Method
Vary: Access-Control-Request-Headers
Content-Type: application/json
Transfer-Encoding: chunked
Date: Wed, 26 Mar 2025 22:42:28 GMT
Keep-Alive: timeout=60
Connection: keep-alive

{
    "timestamp": "2025-03-26T22:42:28.252+00:00",
    "status": 404,
    "error": "Not Found",
    "message": "",
    "path": "/contribute"
}
Request method:	POST
Request URI:	http://localhost:44745/contribute
Proxy:			<none>
Request params:	<none>
Query params:	<none>
Form params:	<none>
Path params:	<none>
Headers:		Accept=*/*
				Content-Type=application/json;charset=utf-8
Cookies:		<none>
Multiparts:		<none>
Body:
{
    "token": "",
    "amount": 1000
}

HTTP/1.1 404 
Vary: Origin
Vary: Access-Control-Request-Method
Vary: Access-Control-Request-Headers
Content-Type: application/json
Transfer-Encoding: chunked
Date: Wed, 26 Mar 2025 22:42:28 GMT
Keep-Alive: timeout=60
Connection: keep-alive

{
    "timestamp": "2025-03-26T22:42:28.517+00:00",
    "status": 404,
    "error": "Not Found",
    "message": "",
    "path": "/contribute"
}
Request method:	POST
Request URI:	http://localhost:44745/contribute
Proxy:			<none>
Request params:	<none>
Query params:	<none>
Form params:	<none>
Path params:	<none>
Headers:		Accept=*/*
				Content-Type=application/json;charset=utf-8
Cookies:		<none>
Multiparts:		<none>
Body:
{
    "token": "valid_token",
    "amount": 1000
}

HTTP/1.1 404 
Vary: Origin
Vary: Access-Control-Request-Method
Vary: Access-Control-Request-Headers
Content-Type: application/json
Transfer-Encoding: chunked
Date: Wed, 26 Mar 2025 22:42:28 GMT
Keep-Alive: timeout=60
Connection: keep-alive

{
    "timestamp": "2025-03-26T22:42:28.562+00:00",
    "status": 404,
    "error": "Not Found",
    "message": "",
    "path": "/contribute"
}
Request method:	POST
Request URI:	http://localhost:44745/contribute
Proxy:			<none>
Request params:	<none>
Query params:	<none>
Form params:	<none>
Path params:	<none>
Headers:		Accept=*/*
				Content-Type=application/json;charset=utf-8
Cookies:		<none>
Multiparts:		<none>
Body:
{
    "token": "exception_token",
    "amount": 1000
}

HTTP/1.1 404 
Vary: Origin
Vary: Access-Control-Request-Method
Vary: Access-Control-Request-Headers
Content-Type: application/json
Transfer-Encoding: chunked
Date: Wed, 26 Mar 2025 22:42:28 GMT
Keep-Alive: timeout=60
Connection: keep-alive

{
    "timestamp": "2025-03-26T22:42:28.599+00:00",
    "status": 404,
    "error": "Not Found",
    "message": "",
    "path": "/contribute"
}
[[1;31mERROR[m] [1;31mTests [0;1mrun: [0;1m7[m, [1;31mFailures: [0;1;31m4[m, [1;31mErrors: [0;1;31m1[m, Skipped: 0, Time elapsed: 7.659 s[1;31m <<< FAILURE![m - in eu.fayder.restcountries.[1msonnet35_run01_StripeRestTest[m
[[1;31mERROR[m] testContributeNullContribution(eu.fayder.restcountries.sonnet35_run01_StripeRestTest)  Time elapsed: 0.244 s  <<< ERROR!
java.lang.IllegalArgumentException: object cannot be null
	at eu.fayder.restcountries.sonnet35_run01_StripeRestTest.testContributeNullContribution(sonnet35_run01_StripeRestTest.java:68)

[[1;31mERROR[m] testContributeNullToken(eu.fayder.restcountries.sonnet35_run01_StripeRestTest)  Time elapsed: 1.121 s  <<< FAILURE!
java.lang.AssertionError: 
1 expectation failed.
Expected status code <400> but was <404>.

	at eu.fayder.restcountries.sonnet35_run01_StripeRestTest.testContributeNullToken(sonnet35_run01_StripeRestTest.java:83)

[[1;31mERROR[m] testContributeEmptyToken(eu.fayder.restcountries.sonnet35_run01_StripeRestTest)  Time elapsed: 0.04 s  <<< FAILURE!
java.lang.AssertionError: 
1 expectation failed.
Expected status code <400> but was <404>.

	at eu.fayder.restcountries.sonnet35_run01_StripeRestTest.testContributeEmptyToken(sonnet35_run01_StripeRestTest.java:94)

[[1;31mERROR[m] testContributeValidToken(eu.fayder.restcountries.sonnet35_run01_StripeRestTest)  Time elapsed: 0.043 s  <<< FAILURE!
java.lang.AssertionError: 
1 expectation failed.
Expected status code <400> but was <404>.

	at eu.fayder.restcountries.sonnet35_run01_StripeRestTest.testContributeValidToken(sonnet35_run01_StripeRestTest.java:105)

[[1;31mERROR[m] testContributeStripeException(eu.fayder.restcountries.sonnet35_run01_StripeRestTest)  Time elapsed: 0.179 s  <<< FAILURE!
java.lang.AssertionError: 
1 expectation failed.
Expected status code <400> but was <404>.

	at eu.fayder.restcountries.sonnet35_run01_StripeRestTest.testContributeStripeException(sonnet35_run01_StripeRestTest.java:116)

2025-03-26 19:42:28,808 INFO  [org.springframework.scheduling.concurrent.ThreadPoolTaskExecutor:218] Shutting down ExecutorService 'applicationTaskExecutor'
[[1;34mINFO[m] 
[[1;34mINFO[m] Results:
[[1;34mINFO[m] 
[[1;31mERROR[m] [1;31mFailures: [m
[[1;31mERROR[m] [1;31m  sonnet35_run01_StripeRestTest.testContributeEmptyToken:94 1 expectation failed.
Expected status code <400> but was <404>.
[m
[[1;31mERROR[m] [1;31m  sonnet35_run01_StripeRestTest.testContributeNullToken:83 1 expectation failed.
Expected status code <400> but was <404>.
[m
[[1;31mERROR[m] [1;31m  sonnet35_run01_StripeRestTest.testContributeStripeException:116 1 expectation failed.
Expected status code <400> but was <404>.
[m
[[1;31mERROR[m] [1;31m  sonnet35_run01_StripeRestTest.testContributeValidToken:105 1 expectation failed.
Expected status code <400> but was <404>.
[m
[[1;31mERROR[m] [1;31mErrors: [m
[[1;31mERROR[m] [1;31m  sonnet35_run01_StripeRestTest.testContributeNullContribution:68 » IllegalArgument[m
[[1;34mINFO[m] 
[[1;31mERROR[m] [1;31mTests run: 7, Failures: 4, Errors: 1, Skipped: 0[m
[[1;34mINFO[m] 
[[1;34mINFO[m] [1m------------------------------------------------------------------------[m
[[1;34mINFO[m] [1;31mBUILD FAILURE[m
[[1;34mINFO[m] [1m------------------------------------------------------------------------[m
[[1;34mINFO[m] Total time:  11.476 s
[[1;34mINFO[m] Finished at: 2025-03-26T19:42:29-03:00
[[1;34mINFO[m] [1m------------------------------------------------------------------------[m
[[1;31mERROR[m] Failed to execute goal [32morg.apache.maven.plugins:maven-surefire-plugin:2.22.0:test[m [1m(default-test)[m on project [36mrestcountries[m: [1;31mThere are test failures.[m
[[1;31mERROR[m] [1;31m[m
[[1;31mERROR[m] [1;31mPlease refer to /media/rincon/63999417195/eclipse-workspace/EMB-master/jdk_8_maven/cs/rest/original/restcountries/target/surefire-reports for the individual test results.[m
[[1;31mERROR[m] [1;31mPlease refer to dump files (if any exist) [date]-jvmRun[N].dump, [date].dumpstream and [date]-jvmRun[N].dumpstream.[m
[[1;31mERROR[m] -> [1m[Help 1][m
[[1;31mERROR[m] 
[[1;31mERROR[m] To see the full stack trace of the errors, re-run Maven with the [1m-e[m switch.
[[1;31mERROR[m] Re-run Maven using the [1m-X[m switch to enable full debug logging.
[[1;31mERROR[m] 
[[1;31mERROR[m] For more information about the errors and possible solutions, please read the following articles:
[[1;31mERROR[m] [1m[Help 1][m http://cwiki.apache.org/confluence/display/MAVEN/MojoFailureException
