[[1;34mINFO[m] Scanning for projects...
[[1;34mINFO[m] 
[[1;34mINFO[m] [1m--------------------< [0;36morg.zalando:catwatch-backend[0;1m >--------------------[m
[[1;34mINFO[m] [1mBuilding catwatch-backend 0.0.1-SNAPSHOT[m
[[1;34mINFO[m] [1m--------------------------------[ jar ]---------------------------------[m
[[1;34mINFO[m] 
[[1;34mINFO[m] [1m--- [0;32mmaven-clean-plugin:2.5:clean[m [1m(default-clean)[m @ [36mcatwatch-backend[0;1m ---[m
[[1;34mINFO[m] Deleting /media/rincon/63999417195/eclipse-workspace/EMB-master/jdk_8_maven/cs/rest/original/catwatch/catwatch-backend/target
[[1;34mINFO[m] 
[[1;34mINFO[m] [1m--- [0;32mjacoco-maven-plugin:0.8.7:prepare-agent[m [1m(prepare-agent)[m @ [36mcatwatch-backend[0;1m ---[m
[[1;34mINFO[m] argLine set to -javaagent:/home/rincon/.m2/repository/org/jacoco/org.jacoco.agent/0.8.7/org.jacoco.agent-0.8.7-runtime.jar=destfile=/media/rincon/63999417195/eclipse-workspace/EMB-master/jdk_8_maven/cs/rest/original/catwatch/catwatch-backend/target/jacoco.exec
[[1;34mINFO[m] 
[[1;34mINFO[m] [1m--- [0;32mjacoco-maven-plugin:0.8.7:prepare-agent[m [1m(default)[m @ [36mcatwatch-backend[0;1m ---[m
[[1;34mINFO[m] argLine set to -javaagent:/home/rincon/.m2/repository/org/jacoco/org.jacoco.agent/0.8.7/org.jacoco.agent-0.8.7-runtime.jar=destfile=/media/rincon/63999417195/eclipse-workspace/EMB-master/jdk_8_maven/cs/rest/original/catwatch/catwatch-backend/target/jacoco.exec
[[1;34mINFO[m] 
[[1;34mINFO[m] [1m--- [0;32mapt-maven-plugin:1.1.3:process[m [1m(default)[m @ [36mcatwatch-backend[0;1m ---[m
[[1;34mINFO[m] 
[[1;34mINFO[m] [1m--- [0;32mspring-boot-maven-plugin:1.5.4.RELEASE:build-info[m [1m(default)[m @ [36mcatwatch-backend[0;1m ---[m
[[1;34mINFO[m] 
[[1;34mINFO[m] [1m--- [0;32mmaven-resources-plugin:2.6:resources[m [1m(default-resources)[m @ [36mcatwatch-backend[0;1m ---[m
[[1;34mINFO[m] Using 'UTF-8' encoding to copy filtered resources.
[[1;34mINFO[m] Copying 14 resources
[[1;34mINFO[m] 
[[1;34mINFO[m] [1m--- [0;32mmaven-compiler-plugin:3.8.0:compile[m [1m(default-compile)[m @ [36mcatwatch-backend[0;1m ---[m
[[1;34mINFO[m] Changes detected - recompiling the module!
[[1;34mINFO[m] Compiling 74 source files to /media/rincon/63999417195/eclipse-workspace/EMB-master/jdk_8_maven/cs/rest/original/catwatch/catwatch-backend/target/classes
[[1;34mINFO[m] 
[[1;34mINFO[m] [1m--- [0;32mjacoco-maven-plugin:0.8.7:prepare-agent[m [1m(prepare-agent)[m @ [36mcatwatch-backend[0;1m ---[m
[[1;34mINFO[m] argLine set to -javaagent:/home/rincon/.m2/repository/org/jacoco/org.jacoco.agent/0.8.7/org.jacoco.agent-0.8.7-runtime.jar=destfile=/media/rincon/63999417195/eclipse-workspace/EMB-master/jdk_8_maven/cs/rest/original/catwatch/catwatch-backend/target/jacoco.exec
[[1;34mINFO[m] 
[[1;34mINFO[m] [1m--- [0;32mjacoco-maven-plugin:0.8.7:prepare-agent[m [1m(default)[m @ [36mcatwatch-backend[0;1m ---[m
[[1;34mINFO[m] argLine set to -javaagent:/home/rincon/.m2/repository/org/jacoco/org.jacoco.agent/0.8.7/org.jacoco.agent-0.8.7-runtime.jar=destfile=/media/rincon/63999417195/eclipse-workspace/EMB-master/jdk_8_maven/cs/rest/original/catwatch/catwatch-backend/target/jacoco.exec
[[1;34mINFO[m] 
[[1;34mINFO[m] [1m--- [0;32mapt-maven-plugin:1.1.3:process[m [1m(default)[m @ [36mcatwatch-backend[0;1m ---[m
[[1;34mINFO[m] 
[[1;34mINFO[m] [1m--- [0;32mspring-boot-maven-plugin:1.5.4.RELEASE:build-info[m [1m(default)[m @ [36mcatwatch-backend[0;1m ---[m
[[1;34mINFO[m] 
[[1;34mINFO[m] [1m--- [0;32mmaven-resources-plugin:2.6:resources[m [1m(default-resources)[m @ [36mcatwatch-backend[0;1m ---[m
[[1;34mINFO[m] Using 'UTF-8' encoding to copy filtered resources.
[[1;34mINFO[m] Copying 14 resources
[[1;34mINFO[m] 
[[1;34mINFO[m] [1m--- [0;32mmaven-compiler-plugin:3.8.0:compile[m [1m(default-compile)[m @ [36mcatwatch-backend[0;1m ---[m
[[1;34mINFO[m] Changes detected - recompiling the module!
[[1;34mINFO[m] Compiling 74 source files to /media/rincon/63999417195/eclipse-workspace/EMB-master/jdk_8_maven/cs/rest/original/catwatch/catwatch-backend/target/classes
[[1;34mINFO[m] 
[[1;34mINFO[m] [1m--- [0;32mmaven-resources-plugin:2.6:testResources[m [1m(default-testResources)[m @ [36mcatwatch-backend[0;1m ---[m
[[1;34mINFO[m] Using 'UTF-8' encoding to copy filtered resources.
[[1;34mINFO[m] skip non existing resourceDirectory /media/rincon/63999417195/eclipse-workspace/EMB-master/jdk_8_maven/cs/rest/original/catwatch/catwatch-backend/src/test/resources
[[1;34mINFO[m] 
[[1;34mINFO[m] [1m--- [0;32mmaven-compiler-plugin:3.8.0:testCompile[m [1m(default-testCompile)[m @ [36mcatwatch-backend[0;1m ---[m
[[1;34mINFO[m] Changes detected - recompiling the module!
[[1;34mINFO[m] Compiling 1 source file to /media/rincon/63999417195/eclipse-workspace/EMB-master/jdk_8_maven/cs/rest/original/catwatch/catwatch-backend/target/test-classes
[[1;34mINFO[m] 
[[1;34mINFO[m] [1m--- [0;32mjacoco-maven-plugin:0.8.7:prepare-agent[m [1m(prepare-agent)[m @ [36mcatwatch-backend[0;1m ---[m
[[1;34mINFO[m] argLine set to -javaagent:/home/rincon/.m2/repository/org/jacoco/org.jacoco.agent/0.8.7/org.jacoco.agent-0.8.7-runtime.jar=destfile=/media/rincon/63999417195/eclipse-workspace/EMB-master/jdk_8_maven/cs/rest/original/catwatch/catwatch-backend/target/jacoco.exec
[[1;34mINFO[m] 
[[1;34mINFO[m] [1m--- [0;32mjacoco-maven-plugin:0.8.7:prepare-agent[m [1m(default)[m @ [36mcatwatch-backend[0;1m ---[m
[[1;34mINFO[m] argLine set to -javaagent:/home/rincon/.m2/repository/org/jacoco/org.jacoco.agent/0.8.7/org.jacoco.agent-0.8.7-runtime.jar=destfile=/media/rincon/63999417195/eclipse-workspace/EMB-master/jdk_8_maven/cs/rest/original/catwatch/catwatch-backend/target/jacoco.exec
[[1;34mINFO[m] 
[[1;34mINFO[m] [1m--- [0;32mapt-maven-plugin:1.1.3:process[m [1m(default)[m @ [36mcatwatch-backend[0;1m ---[m
[[1;34mINFO[m] 
[[1;34mINFO[m] [1m--- [0;32mspring-boot-maven-plugin:1.5.4.RELEASE:build-info[m [1m(default)[m @ [36mcatwatch-backend[0;1m ---[m
[[1;34mINFO[m] 
[[1;34mINFO[m] [1m--- [0;32mmaven-resources-plugin:2.6:resources[m [1m(default-resources)[m @ [36mcatwatch-backend[0;1m ---[m
[[1;34mINFO[m] Using 'UTF-8' encoding to copy filtered resources.
[[1;34mINFO[m] Copying 14 resources
[[1;34mINFO[m] 
[[1;34mINFO[m] [1m--- [0;32mmaven-compiler-plugin:3.8.0:compile[m [1m(default-compile)[m @ [36mcatwatch-backend[0;1m ---[m
[[1;34mINFO[m] Nothing to compile - all classes are up to date
[[1;34mINFO[m] 
[[1;34mINFO[m] [1m--- [0;32mmaven-resources-plugin:2.6:testResources[m [1m(default-testResources)[m @ [36mcatwatch-backend[0;1m ---[m
[[1;34mINFO[m] Using 'UTF-8' encoding to copy filtered resources.
[[1;34mINFO[m] skip non existing resourceDirectory /media/rincon/63999417195/eclipse-workspace/EMB-master/jdk_8_maven/cs/rest/original/catwatch/catwatch-backend/src/test/resources
[[1;34mINFO[m] 
[[1;34mINFO[m] [1m--- [0;32mmaven-compiler-plugin:3.8.0:testCompile[m [1m(default-testCompile)[m @ [36mcatwatch-backend[0;1m ---[m
[[1;34mINFO[m] Nothing to compile - all classes are up to date
[[1;34mINFO[m] 
[[1;34mINFO[m] [1m--- [0;32mmaven-surefire-plugin:2.22.0:test[m [1m(default-test)[m @ [36mcatwatch-backend[0;1m ---[m
[[1;34mINFO[m] 
[[1;34mINFO[m] -------------------------------------------------------
[[1;34mINFO[m]  T E S T S
[[1;34mINFO[m] -------------------------------------------------------
[[1;34mINFO[m] Running org.zalando.catwatch.backend.[1msonnet35_run01_ContributorStatsTest[m

  .   ____          _            __ _ _
 /\\ / ___'_ __ _ _(_)_ __  __ _ \ \ \ \
( ( )\___ | '_ | '_| | '_ \/ _` | \ \ \ \
 \\/  ___)| |_)| | | | | || (_| |  ) ) ) )
  '  |____| .__|_| |_|_| |_\__, | / / / /
 =========|_|==============|___/=/_/_/_/
 :: Spring Boot ::        (v1.5.4.RELEASE)

16:30:34.572 [main] INFO  o.a.m.surefire.booter.ForkedBooter - Starting ForkedBooter v2.22.0 on IFTO-PROBOOK with PID 59719 (started by rincon in /media/rincon/63999417195/eclipse-workspace/EMB-master/jdk_8_maven/cs/rest/original/catwatch/catwatch-backend)
16:30:34.575 [main] INFO  o.a.m.surefire.booter.ForkedBooter - No active profile set, falling back to default profiles: default
16:30:35.209 [background-preinit] INFO  o.h.validator.internal.util.Version - HV000001: Hibernate Validator 5.3.5.Final
16:30:35.214 [main] INFO  o.s.b.c.e.AnnotationConfigEmbeddedWebApplicationContext - Refreshing org.springframework.boot.context.embedded.AnnotationConfigEmbeddedWebApplicationContext@2f04993d: startup date [Tue Apr 08 16:30:35 BRT 2025]; root of context hierarchy
16:30:37.372 [main] INFO  o.s.b.f.a.AutowiredAnnotationBeanPostProcessor - JSR-330 'javax.inject.Inject' annotation found and supported for autowiring
16:30:37.717 [main] INFO  o.s.c.s.PostProcessorRegistrationDelegate$BeanPostProcessorChecker - Bean 'org.springframework.retry.annotation.RetryConfiguration' of type [org.springframework.retry.annotation.RetryConfiguration$$EnhancerBySpringCGLIB$$2dd7f80e] is not eligible for getting processed by all BeanPostProcessors (for example: not eligible for auto-proxying)
16:30:37.765 [main] INFO  o.s.c.s.PostProcessorRegistrationDelegate$BeanPostProcessorChecker - Bean 'org.springframework.transaction.annotation.ProxyTransactionManagementConfiguration' of type [org.springframework.transaction.annotation.ProxyTransactionManagementConfiguration$$EnhancerBySpringCGLIB$$38145fe9] is not eligible for getting processed by all BeanPostProcessors (for example: not eligible for auto-proxying)
16:30:38.355 [main] INFO  o.s.b.c.e.t.TomcatEmbeddedServletContainer - Tomcat initialized with port(s): 0 (http)
16:30:38.381 [main] INFO  o.a.catalina.core.StandardService - Starting service [Tomcat]
16:30:38.383 [main] INFO  o.a.catalina.core.StandardEngine - Starting Servlet Engine: Apache Tomcat/8.5.15
16:30:38.506 [localhost-startStop-1] INFO  o.a.c.c.C.[Tomcat].[localhost].[/] - Initializing Spring embedded WebApplicationContext
16:30:38.506 [localhost-startStop-1] INFO  o.s.web.context.ContextLoader - Root WebApplicationContext: initialization completed in 3296 ms
16:30:38.797 [localhost-startStop-1] INFO  o.s.b.w.s.FilterRegistrationBean - Mapping filter: 'metricsFilter' to: [/*]
16:30:38.797 [localhost-startStop-1] INFO  o.s.b.w.s.FilterRegistrationBean - Mapping filter: 'characterEncodingFilter' to: [/*]
16:30:38.797 [localhost-startStop-1] INFO  o.s.b.w.s.FilterRegistrationBean - Mapping filter: 'hiddenHttpMethodFilter' to: [/*]
16:30:38.797 [localhost-startStop-1] INFO  o.s.b.w.s.FilterRegistrationBean - Mapping filter: 'httpPutFormContentFilter' to: [/*]
16:30:38.797 [localhost-startStop-1] INFO  o.s.b.w.s.FilterRegistrationBean - Mapping filter: 'requestContextFilter' to: [/*]
16:30:38.799 [localhost-startStop-1] INFO  o.s.b.w.s.DelegatingFilterProxyRegistrationBean - Mapping filter: 'springSecurityFilterChain' to: [/*]
16:30:38.799 [localhost-startStop-1] INFO  o.s.b.w.s.FilterRegistrationBean - Mapping filter: 'webRequestLoggingFilter' to: [/*]
16:30:38.799 [localhost-startStop-1] INFO  o.s.b.w.s.FilterRegistrationBean - Mapping filter: 'corsFilter' to: [/*]
16:30:38.799 [localhost-startStop-1] INFO  o.s.b.w.s.FilterRegistrationBean - Mapping filter: 'applicationContextIdFilter' to: [/*]
16:30:38.799 [localhost-startStop-1] INFO  o.s.b.w.s.ServletRegistrationBean - Mapping servlet: 'dispatcherServlet' to [/]
16:30:39.370 [main] INFO  o.f.c.internal.util.VersionPrinter - Flyway 3.2.1 by Boxfuse
16:30:39.378 [main] INFO  o.f.c.i.dbsupport.DbSupportFactory - Database: jdbc:h2:mem:testdb (H2 1.4)
16:30:39.414 [main] INFO  o.f.core.internal.command.DbValidate - Validated 6 migrations (execution time 00:00.012s)
16:30:39.432 [main] INFO  o.f.c.i.m.MetaDataTableImpl - Creating Metadata table: "PUBLIC"."schema_version"
16:30:39.457 [main] INFO  o.f.core.internal.command.DbMigrate - Current version of schema "PUBLIC": << Empty Schema >>
16:30:39.457 [main] INFO  o.f.core.internal.command.DbMigrate - Migrating schema "PUBLIC" to version 001 - base version
16:30:39.485 [main] INFO  o.f.core.internal.command.DbMigrate - Migrating schema "PUBLIC" to version 002 - test baseline on migrate
16:30:39.493 [main] INFO  o.f.core.internal.command.DbMigrate - Migrating schema "PUBLIC" to version 003 - change varchar to text
16:30:39.574 [main] INFO  o.f.core.internal.command.DbMigrate - Migrating schema "PUBLIC" to version 004 - maintainers
16:30:39.582 [main] INFO  o.f.core.internal.command.DbMigrate - Migrating schema "PUBLIC" to version 005 - catwatch yaml
16:30:39.598 [main] INFO  o.f.core.internal.command.DbMigrate - Migrating schema "PUBLIC" to version 006 - add external contributors
16:30:39.613 [main] INFO  o.f.core.internal.command.DbMigrate - Successfully applied 6 migrations to schema "PUBLIC" (execution time 00:00.181s).
16:30:39.748 [main] INFO  o.s.o.j.LocalContainerEntityManagerFactoryBean - Building JPA container EntityManagerFactory for persistence unit 'default'
16:30:39.774 [main] INFO  o.h.jpa.internal.util.LogHelper - HHH000204: Processing PersistenceUnitInfo [
	name: default
	...]
16:30:39.900 [main] INFO  org.hibernate.Version - HHH000412: Hibernate Core {5.0.12.Final}
16:30:39.902 [main] INFO  org.hibernate.cfg.Environment - HHH000206: hibernate.properties not found
16:30:39.905 [main] INFO  org.hibernate.cfg.Environment - HHH000021: Bytecode provider name : javassist
16:30:39.970 [main] INFO  o.h.annotations.common.Version - HCANN000001: Hibernate Commons Annotations {5.0.1.Final}
16:30:40.169 [main] INFO  org.hibernate.dialect.Dialect - HHH000400: Using dialect: org.hibernate.dialect.H2Dialect
16:30:40.478 [main] WARN  org.hibernate.mapping.RootClass - HHH000038: Composite-id class does not override equals(): org.zalando.catwatch.backend.model.StatisticsKey
16:30:40.479 [main] WARN  org.hibernate.mapping.RootClass - HHH000039: Composite-id class does not override hashCode(): org.zalando.catwatch.backend.model.StatisticsKey
16:30:40.479 [main] WARN  org.hibernate.mapping.RootClass - HHH000038: Composite-id class does not override equals(): org.zalando.catwatch.backend.model.ContributorKey
16:30:40.479 [main] WARN  org.hibernate.mapping.RootClass - HHH000039: Composite-id class does not override hashCode(): org.zalando.catwatch.backend.model.ContributorKey
16:30:40.780 [main] INFO  o.h.tool.hbm2ddl.SchemaUpdate - HHH000228: Running hbm2ddl schema update
16:30:40.933 [main] INFO  o.s.o.j.LocalContainerEntityManagerFactoryBean - Initialized JPA EntityManagerFactory for persistence unit 'default'
16:30:40.997 [main] INFO  o.z.c.b.github.SnapshotProvider - Cache directory 'target/cache' is not found. Creating new directory.
16:30:40.997 [main] INFO  o.z.c.b.github.SnapshotProvider - Cache directory created successfully.
16:30:41.014 [main] INFO  o.z.c.b.github.SnapshotProvider - Initialized http client with 50 mb cache.
16:30:41.662 [main] INFO  o.h.h.i.QueryTranslatorFactoryInitiator - HHH000397: Using ASTQueryTranslatorFactory
16:30:42.582 [main] INFO  o.s.w.s.m.m.a.RequestMappingHandlerMapping - Mapped "{[/contributors],methods=[GET],produces=[application/json]}" onto public java.util.List<org.zalando.catwatch.backend.model.Contributor> org.zalando.catwatch.backend.web.ContributorsApi.contributorsGet(java.lang.String,java.lang.Integer,java.lang.Integer,java.lang.String,java.lang.String,java.lang.String,java.lang.String)
16:30:42.584 [main] INFO  o.s.w.s.m.m.a.RequestMappingHandlerMapping - Mapped "{[/languages],methods=[GET],produces=[application/json]}" onto public org.springframework.http.ResponseEntity<java.util.Collection<org.zalando.catwatch.backend.model.Language>> org.zalando.catwatch.backend.web.LanguagesApi.languagesGet(java.lang.String,java.lang.Integer,java.lang.Integer,java.lang.String)
16:30:42.586 [main] INFO  o.s.w.s.m.m.a.RequestMappingHandlerMapping - Mapped "{[/projects],methods=[GET],produces=[application/json]}" onto public org.springframework.http.ResponseEntity<java.util.Collection<org.zalando.catwatch.backend.model.Project>> org.zalando.catwatch.backend.web.ProjectsApi.projectsGet(java.lang.String,java.lang.Integer,java.lang.Integer,java.util.Date,java.util.Date,java.lang.String,java.lang.String,java.lang.String)
16:30:42.589 [main] INFO  o.s.w.s.m.m.a.RequestMappingHandlerMapping - Mapped "{[/statistics/projects],methods=[GET],produces=[application/json]}" onto public org.springframework.http.ResponseEntity<java.util.Collection<org.zalando.catwatch.backend.util.ProjectStats>> org.zalando.catwatch.backend.web.StatisticsApi.statisticsProjectGet(java.lang.String,java.lang.String,java.lang.String) throws java.text.ParseException
16:30:42.589 [main] INFO  o.s.w.s.m.m.a.RequestMappingHandlerMapping - Mapped "{[/statistics/contributors],methods=[GET],produces=[application/json]}" onto public org.springframework.http.ResponseEntity<java.util.Collection<org.zalando.catwatch.backend.util.ContributorStats>> org.zalando.catwatch.backend.web.StatisticsApi.statisticsContributorGet(java.lang.String,java.lang.String,java.lang.String) throws java.text.ParseException
16:30:42.590 [main] INFO  o.s.w.s.m.m.a.RequestMappingHandlerMapping - Mapped "{[/statistics/languages],methods=[GET],produces=[application/json]}" onto public org.springframework.http.ResponseEntity<java.util.Collection<org.zalando.catwatch.backend.util.LanguageStats>> org.zalando.catwatch.backend.web.StatisticsApi.statisticsLanguagesGet(java.lang.String,java.lang.String,java.lang.String)
16:30:42.591 [main] INFO  o.s.w.s.m.m.a.RequestMappingHandlerMapping - Mapped "{[/statistics],methods=[GET],produces=[application/json]}" onto public org.springframework.http.ResponseEntity<java.util.Collection<org.zalando.catwatch.backend.model.Statistics>> org.zalando.catwatch.backend.web.StatisticsApi.statisticsGet(java.lang.String,java.lang.String,java.lang.String)
16:30:42.593 [main] INFO  o.s.w.s.m.m.a.RequestMappingHandlerMapping - Mapped "{[/delete],methods=[GET],produces=[application/json;charset=utf-8]}" onto public java.lang.String org.zalando.catwatch.backend.web.admin.AdminController.deleteAll()
16:30:42.594 [main] INFO  o.s.w.s.m.m.a.RequestMappingHandlerMapping - Mapped "{[/export],methods=[GET],produces=[application/json;charset=utf-8]}" onto public org.zalando.catwatch.backend.web.admin.DatabaseDto org.zalando.catwatch.backend.web.admin.AdminController.exportJson()
16:30:42.594 [main] INFO  o.s.w.s.m.m.a.RequestMappingHandlerMapping - Mapped "{[/import],methods=[POST],produces=[application/json;charset=utf-8]}" onto public java.lang.String org.zalando.catwatch.backend.web.admin.AdminController.importJson(org.zalando.catwatch.backend.web.admin.DatabaseDto)
16:30:42.595 [main] INFO  o.s.w.s.m.m.a.RequestMappingHandlerMapping - Mapped "{[/config/scoring.project],methods=[POST],produces=[application/json;charset=utf-8]}" onto public java.util.List<java.lang.String> org.zalando.catwatch.backend.web.admin.AdminController.configScoringProjects(java.lang.String,java.lang.String)
16:30:42.595 [main] INFO  o.s.w.s.m.m.a.RequestMappingHandlerMapping - Mapped "{[/init],methods=[GET],produces=[application/json;charset=utf-8]}" onto public java.lang.String org.zalando.catwatch.backend.web.admin.AdminController.init()
16:30:42.596 [main] INFO  o.s.w.s.m.m.a.RequestMappingHandlerMapping - Mapped "{[/config],methods=[GET],produces=[application/json]}" onto public java.util.Map<java.lang.String, java.lang.String> org.zalando.catwatch.backend.web.config.ConfigController.config() throws java.lang.Exception
16:30:42.597 [main] INFO  o.s.w.s.m.m.a.RequestMappingHandlerMapping - Mapped "{[/fetch],methods=[GET],produces=[application/json;charset=utf-8]}" onto public java.lang.String org.zalando.catwatch.backend.web.fetch.FetchController.fetch() throws java.lang.Exception
16:30:42.604 [main] INFO  o.s.w.s.m.m.a.RequestMappingHandlerMapping - Mapped "{[/swagger-resources]}" onto public org.springframework.http.ResponseEntity<java.util.List<springfox.documentation.swagger.web.SwaggerResource>> springfox.documentation.swagger.web.ApiResourceController.swaggerResources()
16:30:42.606 [main] INFO  o.s.w.s.m.m.a.RequestMappingHandlerMapping - Mapped "{[/swagger-resources/configuration/security]}" onto public org.springframework.http.ResponseEntity<springfox.documentation.swagger.web.SecurityConfiguration> springfox.documentation.swagger.web.ApiResourceController.securityConfiguration()
16:30:42.607 [main] INFO  o.s.w.s.m.m.a.RequestMappingHandlerMapping - Mapped "{[/swagger-resources/configuration/ui]}" onto public org.springframework.http.ResponseEntity<springfox.documentation.swagger.web.UiConfiguration> springfox.documentation.swagger.web.ApiResourceController.uiConfiguration()
16:30:42.613 [main] INFO  o.s.w.s.m.m.a.RequestMappingHandlerMapping - Mapped "{[/error],produces=[text/html]}" onto public org.springframework.web.servlet.ModelAndView org.springframework.boot.autoconfigure.web.BasicErrorController.errorHtml(javax.servlet.http.HttpServletRequest,javax.servlet.http.HttpServletResponse)
16:30:42.613 [main] INFO  o.s.w.s.m.m.a.RequestMappingHandlerMapping - Mapped "{[/error]}" onto public org.springframework.http.ResponseEntity<java.util.Map<java.lang.String, java.lang.Object>> org.springframework.boot.autoconfigure.web.BasicErrorController.error(javax.servlet.http.HttpServletRequest)
16:30:42.989 [main] INFO  o.s.b.a.e.mvc.EndpointHandlerMapping - Mapped "{[/health || /health.json],methods=[GET],produces=[application/vnd.spring-boot.actuator.v1+json || application/json]}" onto public java.lang.Object org.springframework.boot.actuate.endpoint.mvc.HealthMvcEndpoint.invoke(javax.servlet.http.HttpServletRequest,java.security.Principal)
16:30:43.284 [main] INFO  o.s.b.a.s.AuthenticationManagerConfiguration - 

Using default security password: 68ee6c3e-7c6a-40dc-b1e6-aa02243f2799

16:30:43.663 [main] INFO  o.s.s.web.DefaultSecurityFilterChain - Creating filter chain: org.springframework.security.web.util.matcher.AnyRequestMatcher@1, [org.springframework.security.web.context.request.async.WebAsyncManagerIntegrationFilter@378edc44, org.springframework.security.web.context.SecurityContextPersistenceFilter@7a9e844d, org.springframework.security.web.header.HeaderWriterFilter@16e2fb4f, org.springframework.security.web.authentication.logout.LogoutFilter@7c5e6842, org.springframework.security.oauth2.provider.authentication.OAuth2AuthenticationProcessingFilter@2f521b14, org.springframework.security.web.savedrequest.RequestCacheAwareFilter@28de521a, org.springframework.security.web.servletapi.SecurityContextHolderAwareRequestFilter@50ae440c, org.springframework.security.web.authentication.AnonymousAuthenticationFilter@39e35a07, org.springframework.security.web.session.SessionManagementFilter@7c153d, org.springframework.security.web.access.ExceptionTranslationFilter@457264c8, org.springframework.security.web.access.intercept.FilterSecurityInterceptor@109e27df]
16:30:43.685 [main] INFO  o.s.s.web.DefaultSecurityFilterChain - Creating filter chain: org.springframework.boot.actuate.autoconfigure.ManagementWebSecurityAutoConfiguration$LazyEndpointPathRequestMatcher@4930b0e, [org.springframework.security.web.context.request.async.WebAsyncManagerIntegrationFilter@7e55c6e9, org.springframework.security.web.context.SecurityContextPersistenceFilter@2083d30d, org.springframework.security.web.header.HeaderWriterFilter@2b6af37d, org.springframework.security.web.authentication.logout.LogoutFilter@e63a3c, org.springframework.security.web.authentication.www.BasicAuthenticationFilter@12333e63, org.springframework.security.web.savedrequest.RequestCacheAwareFilter@765101ed, org.springframework.security.web.servletapi.SecurityContextHolderAwareRequestFilter@a5ce541, org.springframework.security.web.authentication.AnonymousAuthenticationFilter@759e2f66, org.springframework.security.web.session.SessionManagementFilter@326872b3, org.springframework.security.web.access.ExceptionTranslationFilter@7c955232, org.springframework.security.web.access.intercept.FilterSecurityInterceptor@4bb7b1b1]
16:30:43.752 [main] INFO  s.d.s.w.PropertySourcedRequestMappingHandlerMapping - Mapped URL path [/v2/api-docs] onto method [public org.springframework.http.ResponseEntity<springfox.documentation.spring.web.json.Json> springfox.documentation.swagger2.web.Swagger2Controller.getDocumentation(java.lang.String,javax.servlet.http.HttpServletRequest)]
16:30:44.107 [main] INFO  o.s.w.s.m.m.a.RequestMappingHandlerAdapter - Looking for @ControllerAdvice: org.springframework.boot.context.embedded.AnnotationConfigEmbeddedWebApplicationContext@2f04993d: startup date [Tue Apr 08 16:30:35 BRT 2025]; root of context hierarchy
16:30:44.190 [main] INFO  o.s.w.s.h.SimpleUrlHandlerMapping - Mapped URL path [/webjars/**] onto handler of type [class org.springframework.web.servlet.resource.ResourceHttpRequestHandler]
16:30:44.190 [main] INFO  o.s.w.s.h.SimpleUrlHandlerMapping - Mapped URL path [/**] onto handler of type [class org.springframework.web.servlet.resource.ResourceHttpRequestHandler]
16:30:44.223 [main] INFO  o.s.w.s.h.SimpleUrlHandlerMapping - Mapped URL path [/**/favicon.ico] onto handler of type [class org.springframework.web.servlet.resource.ResourceHttpRequestHandler]
16:30:44.246 [main] INFO  o.s.b.a.w.WebMvcAutoConfiguration$WelcomePageHandlerMapping - Adding welcome page: class path resource [static/index.html]
16:30:44.583 [main] INFO  o.s.j.e.a.AnnotationMBeanExporter - Registering beans for JMX exposure on startup
16:30:44.591 [main] INFO  o.s.b.a.e.jmx.EndpointMBeanExporter - Registering beans for JMX exposure on startup
16:30:44.597 [main] INFO  o.s.c.s.DefaultLifecycleProcessor - Starting beans in phase 0
16:30:44.608 [main] INFO  o.s.b.a.e.jmx.EndpointMBeanExporter - Located managed bean 'healthEndpoint': registering with JMX server as MBean [org.springframework.boot:type=Endpoint,name=healthEndpoint]
16:30:44.629 [main] INFO  o.s.c.s.DefaultLifecycleProcessor - Starting beans in phase 2147483647
16:30:44.629 [main] INFO  s.d.s.w.p.DocumentationPluginsBootstrapper - Context refreshed
16:30:44.660 [main] INFO  s.d.s.w.p.DocumentationPluginsBootstrapper - Found 1 custom documentation plugin(s)
16:30:44.711 [main] INFO  s.d.s.w.s.ApiListingReferenceScanner - Scanning for api listing references
16:30:45.159 [main] INFO  s.d.s.w.r.o.CachingOperationNameGenerator - Generating unique operation named: invokeUsingGET_1
16:30:45.290 [main] INFO  o.s.s.a.ScheduledAnnotationBeanPostProcessor - No TaskScheduler/ScheduledExecutorService bean found for scheduled processing
16:30:45.309 [main] INFO  o.a.coyote.http11.Http11NioProtocol - Initializing ProtocolHandler ["http-nio-auto-1"]
16:30:45.336 [main] INFO  o.a.coyote.http11.Http11NioProtocol - Starting ProtocolHandler ["http-nio-auto-1"]
16:30:45.345 [main] INFO  o.a.tomcat.util.net.NioSelectorPool - Using a shared selector for servlet write/read
16:30:45.371 [main] INFO  o.s.b.c.e.t.TomcatEmbeddedServletContainer - Tomcat started on port(s): 37993 (http)
16:30:45.379 [main] INFO  o.a.m.surefire.booter.ForkedBooter - Started ForkedBooter in 11.206 seconds (JVM running for 12.23)
16:30:45.958 [main] INFO  o.s.c.s.DefaultLifecycleProcessor - Stopping beans in phase 2147483647
16:30:45.959 [main] INFO  o.s.c.s.DefaultLifecycleProcessor - Stopping beans in phase 0
[[1;31mERROR[m] [1;31mTests [0;1mrun: [0;1m8[m, Failures: 0, [1;31mErrors: [0;1;31m6[m, Skipped: 0, Time elapsed: 12.304 s[1;31m <<< FAILURE![m - in org.zalando.catwatch.backend.[1msonnet35_run01_ContributorStatsTest[m
[[1;31mERROR[m] testConstructor(org.zalando.catwatch.backend.sonnet35_run01_ContributorStatsTest)  Time elapsed: 0.035 s  <<< ERROR!
java.lang.IllegalArgumentException: Contributor loginId could not be determinated.
	at org.zalando.catwatch.backend.sonnet35_run01_ContributorStatsTest.testConstructor(sonnet35_run01_ContributorStatsTest.java:63)

[[1;31mERROR[m] testGetters(org.zalando.catwatch.backend.sonnet35_run01_ContributorStatsTest)  Time elapsed: 0.002 s  <<< ERROR!
java.lang.IllegalArgumentException: Contributor loginId could not be determinated.
	at org.zalando.catwatch.backend.sonnet35_run01_ContributorStatsTest.testGetters(sonnet35_run01_ContributorStatsTest.java:92)

[[1;31mERROR[m] testMultipleContributors(org.zalando.catwatch.backend.sonnet35_run01_ContributorStatsTest)  Time elapsed: 0.004 s  <<< ERROR!
java.lang.NullPointerException
	at org.zalando.catwatch.backend.sonnet35_run01_ContributorStatsTest.testMultipleContributors(sonnet35_run01_ContributorStatsTest.java:129)

[[1;31mERROR[m] testDifferentLoginIds(org.zalando.catwatch.backend.sonnet35_run01_ContributorStatsTest)  Time elapsed: 0.004 s  <<< ERROR!
java.lang.Exception: Unexpected exception, expected<java.lang.IllegalArgumentException> but was<java.lang.NullPointerException>
	at org.zalando.catwatch.backend.sonnet35_run01_ContributorStatsTest.testDifferentLoginIds(sonnet35_run01_ContributorStatsTest.java:167)

[[1;31mERROR[m] testToString(org.zalando.catwatch.backend.sonnet35_run01_ContributorStatsTest)  Time elapsed: 0.003 s  <<< ERROR!
java.lang.IllegalArgumentException: Contributor loginId could not be determinated.
	at org.zalando.catwatch.backend.sonnet35_run01_ContributorStatsTest.testToString(sonnet35_run01_ContributorStatsTest.java:178)

[[1;31mERROR[m] testGetDistinctContributors(org.zalando.catwatch.backend.sonnet35_run01_ContributorStatsTest)  Time elapsed: 0.004 s  <<< ERROR!
java.lang.IllegalArgumentException: Could not determinate loginId.
	at org.zalando.catwatch.backend.sonnet35_run01_ContributorStatsTest.testGetDistinctContributors(sonnet35_run01_ContributorStatsTest.java:200)

16:30:46.001 [Thread-6] INFO  o.s.b.c.e.AnnotationConfigEmbeddedWebApplicationContext - Closing org.springframework.boot.context.embedded.AnnotationConfigEmbeddedWebApplicationContext@2f04993d: startup date [Tue Apr 08 16:30:35 BRT 2025]; root of context hierarchy
16:30:46.185 [Thread-6] INFO  o.s.c.s.DefaultLifecycleProcessor - Stopping beans in phase 2147483647
16:30:46.185 [Thread-6] INFO  o.s.c.s.DefaultLifecycleProcessor - Stopping beans in phase 0
16:30:46.185 [Thread-6] INFO  o.s.b.a.e.jmx.EndpointMBeanExporter - Unregistering JMX-exposed beans on shutdown
16:30:46.186 [Thread-6] INFO  o.s.b.a.e.jmx.EndpointMBeanExporter - Unregistering JMX-exposed beans
16:30:46.186 [Thread-6] INFO  o.s.j.e.a.AnnotationMBeanExporter - Unregistering JMX-exposed beans on shutdown
16:30:46.191 [Thread-6] INFO  o.s.o.j.LocalContainerEntityManagerFactoryBean - Closing JPA EntityManagerFactory for persistence unit 'default'
[[1;34mINFO[m] 
[[1;34mINFO[m] Results:
[[1;34mINFO[m] 
[[1;31mERROR[m] [1;31mErrors: [m
[[1;31mERROR[m] [1;31m  sonnet35_run01_ContributorStatsTest.testConstructor:63 » IllegalArgument Contr...[m
[[1;31mERROR[m] [1;31m  sonnet35_run01_ContributorStatsTest.testDifferentLoginIds »  Unexpected except...[m
[[1;31mERROR[m] [1;31m  sonnet35_run01_ContributorStatsTest.testGetDistinctContributors:200 » IllegalArgument[m
[[1;31mERROR[m] [1;31m  sonnet35_run01_ContributorStatsTest.testGetters:92 » IllegalArgument Contribut...[m
[[1;31mERROR[m] [1;31m  sonnet35_run01_ContributorStatsTest.testMultipleContributors:129 » NullPointer[m
[[1;31mERROR[m] [1;31m  sonnet35_run01_ContributorStatsTest.testToString:178 » IllegalArgument Contrib...[m
[[1;34mINFO[m] 
[[1;31mERROR[m] [1;31mTests run: 8, Failures: 0, Errors: 6, Skipped: 0[m
[[1;34mINFO[m] 
[[1;34mINFO[m] [1m------------------------------------------------------------------------[m
[[1;34mINFO[m] [1;31mBUILD FAILURE[m
[[1;34mINFO[m] [1m------------------------------------------------------------------------[m
[[1;34mINFO[m] Total time:  19.301 s
[[1;34mINFO[m] Finished at: 2025-04-08T16:30:46-03:00
[[1;34mINFO[m] [1m------------------------------------------------------------------------[m
[[1;31mERROR[m] Failed to execute goal [32morg.apache.maven.plugins:maven-surefire-plugin:2.22.0:test[m [1m(default-test)[m on project [36mcatwatch-backend[m: [1;31mThere are test failures.[m
[[1;31mERROR[m] [1;31m[m
[[1;31mERROR[m] [1;31mPlease refer to /media/rincon/63999417195/eclipse-workspace/EMB-master/jdk_8_maven/cs/rest/original/catwatch/catwatch-backend/target/surefire-reports for the individual test results.[m
[[1;31mERROR[m] [1;31mPlease refer to dump files (if any exist) [date]-jvmRun[N].dump, [date].dumpstream and [date]-jvmRun[N].dumpstream.[m
[[1;31mERROR[m] -> [1m[Help 1][m
[[1;31mERROR[m] 
[[1;31mERROR[m] To see the full stack trace of the errors, re-run Maven with the [1m-e[m switch.
[[1;31mERROR[m] Re-run Maven using the [1m-X[m switch to enable full debug logging.
[[1;31mERROR[m] 
[[1;31mERROR[m] For more information about the errors and possible solutions, please read the following articles:
[[1;31mERROR[m] [1m[Help 1][m http://cwiki.apache.org/confluence/display/MAVEN/MojoFailureException
