[[1;34mINFO[m] Scanning for projects...
[[1;33mWARNING[m] 
[[1;33mWARNING[m] Some problems were encountered while building the effective model for eu.fayder:restcountries:jar:2.0.6-SNAPSHOT
[[1;33mWARNING[m] 'dependencies.dependency.(groupId:artifactId:type:classifier)' must be unique: com.google.code.gson:gson:jar -> version ${gson.version} vs 2.8.9 @ line 111, column 21
[[1;33mWARNING[m] 
[[1;33mWARNING[m] It is highly recommended to fix these problems because they threaten the stability of your build.
[[1;33mWARNING[m] 
[[1;33mWARNING[m] For this reason, future Maven versions might no longer support building such malformed projects.
[[1;33mWARNING[m] 
[[1;34mINFO[m] 
[[1;34mINFO[m] [1m----------------------< [0;36meu.fayder:restcountries[0;1m >-----------------------[m
[[1;34mINFO[m] [1mBuilding restcountries 2.0.6-SNAPSHOT[m
[[1;34mINFO[m] [1m--------------------------------[ jar ]---------------------------------[m
[[1;34mINFO[m] 
[[1;34mINFO[m] [1m--- [0;32mmaven-clean-plugin:2.5:clean[m [1m(default-clean)[m @ [36mrestcountries[0;1m ---[m
[[1;34mINFO[m] Deleting /media/rincon/63999417195/eclipse-workspace/EMB-master/jdk_8_maven/cs/rest/original/restcountries/target
[[1;34mINFO[m] 
[[1;34mINFO[m] [1m--- [0;32mjacoco-maven-plugin:0.8.7:prepare-agent[m [1m(default)[m @ [36mrestcountries[0;1m ---[m
[[1;34mINFO[m] argLine set to -javaagent:/home/rincon/.m2/repository/org/jacoco/org.jacoco.agent/0.8.7/org.jacoco.agent-0.8.7-runtime.jar=destfile=/media/rincon/63999417195/eclipse-workspace/EMB-master/jdk_8_maven/cs/rest/original/restcountries/target/jacoco.exec
[[1;34mINFO[m] 
[[1;34mINFO[m] [1m--- [0;32mmaven-resources-plugin:2.6:resources[m [1m(default-resources)[m @ [36mrestcountries[0;1m ---[m
[[1;34mINFO[m] Using 'UTF-8' encoding to copy filtered resources.
[[1;34mINFO[m] Copying 6 resources
[[1;34mINFO[m] 
[[1;34mINFO[m] [1m--- [0;32mmaven-compiler-plugin:3.8.0:compile[m [1m(default-compile)[m @ [36mrestcountries[0;1m ---[m
[[1;34mINFO[m] Changes detected - recompiling the module!
[[1;34mINFO[m] Compiling 22 source files to /media/rincon/63999417195/eclipse-workspace/EMB-master/jdk_8_maven/cs/rest/original/restcountries/target/classes
[[1;34mINFO[m] /media/rincon/63999417195/eclipse-workspace/EMB-master/jdk_8_maven/cs/rest/original/restcountries/src/main/java/eu/fayder/restcountries/v2/rest/CountryRestV2.java: /media/rincon/63999417195/eclipse-workspace/EMB-master/jdk_8_maven/cs/rest/original/restcountries/src/main/java/eu/fayder/restcountries/v2/rest/CountryRestV2.java uses or overrides a deprecated API.
[[1;34mINFO[m] /media/rincon/63999417195/eclipse-workspace/EMB-master/jdk_8_maven/cs/rest/original/restcountries/src/main/java/eu/fayder/restcountries/v2/rest/CountryRestV2.java: Recompile with -Xlint:deprecation for details.
[[1;34mINFO[m] 
[[1;34mINFO[m] [1m--- [0;32mjacoco-maven-plugin:0.8.7:prepare-agent[m [1m(default)[m @ [36mrestcountries[0;1m ---[m
[[1;34mINFO[m] argLine set to -javaagent:/home/rincon/.m2/repository/org/jacoco/org.jacoco.agent/0.8.7/org.jacoco.agent-0.8.7-runtime.jar=destfile=/media/rincon/63999417195/eclipse-workspace/EMB-master/jdk_8_maven/cs/rest/original/restcountries/target/jacoco.exec
[[1;34mINFO[m] 
[[1;34mINFO[m] [1m--- [0;32mmaven-resources-plugin:2.6:resources[m [1m(default-resources)[m @ [36mrestcountries[0;1m ---[m
[[1;34mINFO[m] Using 'UTF-8' encoding to copy filtered resources.
[[1;34mINFO[m] Copying 6 resources
[[1;34mINFO[m] 
[[1;34mINFO[m] [1m--- [0;32mmaven-compiler-plugin:3.8.0:compile[m [1m(default-compile)[m @ [36mrestcountries[0;1m ---[m
[[1;34mINFO[m] Nothing to compile - all classes are up to date
[[1;34mINFO[m] 
[[1;34mINFO[m] [1m--- [0;32mmaven-resources-plugin:2.6:testResources[m [1m(default-testResources)[m @ [36mrestcountries[0;1m ---[m
[[1;34mINFO[m] Using 'UTF-8' encoding to copy filtered resources.
[[1;34mINFO[m] Copying 1 resource
[[1;34mINFO[m] 
[[1;34mINFO[m] [1m--- [0;32mmaven-compiler-plugin:3.8.0:testCompile[m [1m(default-testCompile)[m @ [36mrestcountries[0;1m ---[m
[[1;34mINFO[m] Changes detected - recompiling the module!
[[1;34mINFO[m] Compiling 1 source file to /media/rincon/63999417195/eclipse-workspace/EMB-master/jdk_8_maven/cs/rest/original/restcountries/target/test-classes
[[1;34mINFO[m] 
[[1;34mINFO[m] [1m--- [0;32mjacoco-maven-plugin:0.8.7:prepare-agent[m [1m(default)[m @ [36mrestcountries[0;1m ---[m
[[1;34mINFO[m] argLine set to -javaagent:/home/rincon/.m2/repository/org/jacoco/org.jacoco.agent/0.8.7/org.jacoco.agent-0.8.7-runtime.jar=destfile=/media/rincon/63999417195/eclipse-workspace/EMB-master/jdk_8_maven/cs/rest/original/restcountries/target/jacoco.exec
[[1;34mINFO[m] 
[[1;34mINFO[m] [1m--- [0;32mmaven-resources-plugin:2.6:resources[m [1m(default-resources)[m @ [36mrestcountries[0;1m ---[m
[[1;34mINFO[m] Using 'UTF-8' encoding to copy filtered resources.
[[1;34mINFO[m] Copying 6 resources
[[1;34mINFO[m] 
[[1;34mINFO[m] [1m--- [0;32mmaven-compiler-plugin:3.8.0:compile[m [1m(default-compile)[m @ [36mrestcountries[0;1m ---[m
[[1;34mINFO[m] Nothing to compile - all classes are up to date
[[1;34mINFO[m] 
[[1;34mINFO[m] [1m--- [0;32mmaven-resources-plugin:2.6:testResources[m [1m(default-testResources)[m @ [36mrestcountries[0;1m ---[m
[[1;34mINFO[m] Using 'UTF-8' encoding to copy filtered resources.
[[1;34mINFO[m] Copying 1 resource
[[1;34mINFO[m] 
[[1;34mINFO[m] [1m--- [0;32mmaven-compiler-plugin:3.8.0:testCompile[m [1m(default-testCompile)[m @ [36mrestcountries[0;1m ---[m
[[1;34mINFO[m] Nothing to compile - all classes are up to date
[[1;34mINFO[m] 
[[1;34mINFO[m] [1m--- [0;32mmaven-surefire-plugin:2.22.0:test[m [1m(default-test)[m @ [36mrestcountries[0;1m ---[m
[[1;34mINFO[m] 
[[1;34mINFO[m] -------------------------------------------------------
[[1;34mINFO[m]  T E S T S
[[1;34mINFO[m] -------------------------------------------------------
[[1;34mINFO[m] Running eu.fayder.restcountries.[1mgpt4o_run01_CountryServiceBaseTest[m

  .   ____          _            __ _ _
 /\\ / ___'_ __ _ _(_)_ __  __ _ \ \ \ \
( ( )\___ | '_ | '_| | '_ \/ _` | \ \ \ \
 \\/  ___)| |_)| | | | | || (_| |  ) ) ) )
  '  |____| .__|_| |_|_| |_\__, | / / / /
 =========|_|==============|___/=/_/_/_/
 :: Spring Boot ::        (v2.3.2.RELEASE)

2025-03-26 20:30:55,195 INFO  [org.apache.maven.surefire.booter.ForkedBooter:55] Starting ForkedBooter v2.22.0 on IFTO-PROBOOK with PID 91587 (started by rincon in /media/rincon/63999417195/eclipse-workspace/EMB-master/jdk_8_maven/cs/rest/original/restcountries)
2025-03-26 20:30:55,201 INFO  [org.apache.maven.surefire.booter.ForkedBooter:651] No active profile set, falling back to default profiles: default
2025-03-26 20:30:56,841 INFO  [org.jboss.resteasy.springboot.ResteasyEmbeddedServletInitializer:74] Finding JAX-RS Application classes
2025-03-26 20:30:56,845 INFO  [org.jboss.resteasy.springboot.ResteasyEmbeddedServletInitializer:111] Property resteasy.jaxrs.app.registration has been set to property
2025-03-26 20:30:56,846 INFO  [org.jboss.resteasy.springboot.ResteasyEmbeddedServletInitializer:154] Property resteasy.jaxrs.app.classes has been set to eu.fayder.restcountries.servlet.RestApplication
2025-03-26 20:30:56,847 INFO  [org.jboss.resteasy.springboot.ResteasyEmbeddedServletInitializer:99] JAX-RS Application class found: eu.fayder.restcountries.servlet.RestApplication
2025-03-26 20:30:57,285 INFO  [org.springframework.boot.web.embedded.tomcat.TomcatWebServer:108] Tomcat initialized with port(s): 0 (http)
2025-03-26 20:30:57,508 INFO  [org.springframework.boot.web.servlet.context.ServletWebServerApplicationContext:285] Root WebApplicationContext: initialization completed in 1808 ms
2025-03-26 20:30:58,012 INFO  [org.springframework.scheduling.concurrent.ThreadPoolTaskExecutor:181] Initializing ExecutorService 'applicationTaskExecutor'
2025-03-26 20:30:58,244 INFO  [org.springframework.boot.autoconfigure.web.servlet.WelcomePageHandlerMapping:54] Adding welcome page: ServletContext resource [/index.html]
2025-03-26 20:30:59,144 INFO  [org.jboss.resteasy.resteasy_jaxrs.i18n:160] RESTEASY002225: Deploying javax.ws.rs.core.Application: class eu.fayder.restcountries.servlet.RestApplication
2025-03-26 20:30:59,144 INFO  [org.jboss.resteasy.resteasy_jaxrs.i18n:187] RESTEASY002220: Adding singleton resource eu.fayder.restcountries.v2.rest.CountryRestV2 from Application class eu.fayder.restcountries.servlet.RestApplication
2025-03-26 20:30:59,145 INFO  [org.jboss.resteasy.resteasy_jaxrs.i18n:187] RESTEASY002220: Adding singleton resource eu.fayder.restcountries.v1.rest.CountryRestV1 from Application class eu.fayder.restcountries.servlet.RestApplication
2025-03-26 20:30:59,145 INFO  [org.jboss.resteasy.resteasy_jaxrs.i18n:187] RESTEASY002220: Adding singleton resource eu.fayder.restcountries.v2.rest.StripeRest from Application class eu.fayder.restcountries.servlet.RestApplication
2025-03-26 20:30:59,216 INFO  [org.springframework.boot.web.embedded.tomcat.TomcatWebServer:220] Tomcat started on port(s): 45457 (http) with context path ''
2025-03-26 20:30:59,241 INFO  [org.apache.maven.surefire.booter.ForkedBooter:61] Started ForkedBooter in 4.899 seconds (JVM running for 5.911)
2025-03-26 20:31:00,641 INFO  [org.springframework.web.servlet.DispatcherServlet:525] Initializing Servlet 'dispatcherServlet'
2025-03-26 20:31:00,650 INFO  [org.springframework.web.servlet.DispatcherServlet:547] Completed initialization in 8 ms
Request method:	GET
Request URI:	http://localhost:45457/v1/alpha?codes=
Proxy:			<none>
Request params:	<none>
Query params:	codes=
Form params:	<none>
Path params:	<none>
Headers:		Accept=*/*
Cookies:		<none>
Multiparts:		<none>
Body:			<none>

HTTP/1.1 404 
Vary: Origin
Vary: Access-Control-Request-Method
Vary: Access-Control-Request-Headers
Content-Type: application/json
Transfer-Encoding: chunked
Date: Wed, 26 Mar 2025 23:31:00 GMT
Keep-Alive: timeout=60
Connection: keep-alive

{
    "timestamp": "2025-03-26T23:31:00.707+00:00",
    "status": 404,
    "error": "Not Found",
    "message": "",
    "path": "/v1/alpha"
}
Request method:	GET
Request URI:	http://localhost:45457/v1/alpha?codes=US;GB
Proxy:			<none>
Request params:	<none>
Query params:	codes=US;GB
Form params:	<none>
Path params:	<none>
Headers:		Accept=*/*
Cookies:		<none>
Multiparts:		<none>
Body:			<none>

HTTP/1.1 404 
Vary: Origin
Vary: Access-Control-Request-Method
Vary: Access-Control-Request-Headers
Content-Type: application/json
Transfer-Encoding: chunked
Date: Wed, 26 Mar 2025 23:31:00 GMT
Keep-Alive: timeout=60
Connection: keep-alive

{
    "timestamp": "2025-03-26T23:31:01.034+00:00",
    "status": 404,
    "error": "Not Found",
    "message": "",
    "path": "/v1/alpha"
}
[[1;31mERROR[m] [1;31mTests [0;1mrun: [0;1m6[m, [1;31mFailures: [0;1;31m3[m, [1;31mErrors: [0;1;31m2[m, Skipped: 0, Time elapsed: 7.177 s[1;31m <<< FAILURE![m - in eu.fayder.restcountries.[1mgpt4o_run01_CountryServiceBaseTest[m
[[1;31mERROR[m] testGetByCodeList_NullCodeList(eu.fayder.restcountries.gpt4o_run01_CountryServiceBaseTest)  Time elapsed: 1.359 s  <<< FAILURE!
java.lang.AssertionError: 
1 expectation failed.
Expected status code <200> but was <404>.

	at eu.fayder.restcountries.gpt4o_run01_CountryServiceBaseTest.testGetByCodeList_NullCodeList(gpt4o_run01_CountryServiceBaseTest.java:65)

[[1;31mERROR[m] testGetByCodeList_ValidCodeList(eu.fayder.restcountries.gpt4o_run01_CountryServiceBaseTest)  Time elapsed: 0.033 s  <<< FAILURE!
java.lang.AssertionError: 
1 expectation failed.
Expected status code <200> but was <404>.

	at eu.fayder.restcountries.gpt4o_run01_CountryServiceBaseTest.testGetByCodeList_ValidCodeList(gpt4o_run01_CountryServiceBaseTest.java:77)

[[1;31mERROR[m] testFullTextSearch_ExactMatch(eu.fayder.restcountries.gpt4o_run01_CountryServiceBaseTest)  Time elapsed: 0.007 s  <<< ERROR!
java.net.URISyntaxException: Illegal character in path at index 37: http://localhost:45457/v1/name/United States
	at eu.fayder.restcountries.gpt4o_run01_CountryServiceBaseTest.testFullTextSearch_ExactMatch(gpt4o_run01_CountryServiceBaseTest.java:89)

[[1;31mERROR[m] testFullTextSearch_NoMatch(eu.fayder.restcountries.gpt4o_run01_CountryServiceBaseTest)  Time elapsed: 0.005 s  <<< ERROR!
java.net.URISyntaxException: Illegal character in path at index 43: http://localhost:45457/v1/name/Non-Existent Country
	at eu.fayder.restcountries.gpt4o_run01_CountryServiceBaseTest.testFullTextSearch_NoMatch(gpt4o_run01_CountryServiceBaseTest.java:103)

[[1;31mERROR[m] testLoadJson_ValidFile(eu.fayder.restcountries.gpt4o_run01_CountryServiceBaseTest)  Time elapsed: 0 s  <<< FAILURE!
java.lang.AssertionError: 
	at eu.fayder.restcountries.gpt4o_run01_CountryServiceBaseTest.testLoadJson_ValidFile(gpt4o_run01_CountryServiceBaseTest.java:114)

2025-03-26 20:31:01,114 INFO  [org.springframework.scheduling.concurrent.ThreadPoolTaskExecutor:218] Shutting down ExecutorService 'applicationTaskExecutor'
[[1;34mINFO[m] 
[[1;34mINFO[m] Results:
[[1;34mINFO[m] 
[[1;31mERROR[m] [1;31mFailures: [m
[[1;31mERROR[m] [1;31m  gpt4o_run01_CountryServiceBaseTest.testGetByCodeList_NullCodeList:65 1 expectation failed.
Expected status code <200> but was <404>.
[m
[[1;31mERROR[m] [1;31m  gpt4o_run01_CountryServiceBaseTest.testGetByCodeList_ValidCodeList:77 1 expectation failed.
Expected status code <200> but was <404>.
[m
[[1;31mERROR[m] [1;31m  gpt4o_run01_CountryServiceBaseTest.testLoadJson_ValidFile:114[m
[[1;31mERROR[m] [1;31mErrors: [m
[[1;31mERROR[m] [1;31m  gpt4o_run01_CountryServiceBaseTest.testFullTextSearch_ExactMatch:89 » URISyntax[m
[[1;31mERROR[m] [1;31m  gpt4o_run01_CountryServiceBaseTest.testFullTextSearch_NoMatch:103 » URISyntax ...[m
[[1;34mINFO[m] 
[[1;31mERROR[m] [1;31mTests run: 6, Failures: 3, Errors: 2, Skipped: 0[m
[[1;34mINFO[m] 
[[1;34mINFO[m] [1m------------------------------------------------------------------------[m
[[1;34mINFO[m] [1;31mBUILD FAILURE[m
[[1;34mINFO[m] [1m------------------------------------------------------------------------[m
[[1;34mINFO[m] Total time:  10.983 s
[[1;34mINFO[m] Finished at: 2025-03-26T20:31:01-03:00
[[1;34mINFO[m] [1m------------------------------------------------------------------------[m
[[1;31mERROR[m] Failed to execute goal [32morg.apache.maven.plugins:maven-surefire-plugin:2.22.0:test[m [1m(default-test)[m on project [36mrestcountries[m: [1;31mThere are test failures.[m
[[1;31mERROR[m] [1;31m[m
[[1;31mERROR[m] [1;31mPlease refer to /media/rincon/63999417195/eclipse-workspace/EMB-master/jdk_8_maven/cs/rest/original/restcountries/target/surefire-reports for the individual test results.[m
[[1;31mERROR[m] [1;31mPlease refer to dump files (if any exist) [date]-jvmRun[N].dump, [date].dumpstream and [date]-jvmRun[N].dumpstream.[m
[[1;31mERROR[m] -> [1m[Help 1][m
[[1;31mERROR[m] 
[[1;31mERROR[m] To see the full stack trace of the errors, re-run Maven with the [1m-e[m switch.
[[1;31mERROR[m] Re-run Maven using the [1m-X[m switch to enable full debug logging.
[[1;31mERROR[m] 
[[1;31mERROR[m] For more information about the errors and possible solutions, please read the following articles:
[[1;31mERROR[m] [1m[Help 1][m http://cwiki.apache.org/confluence/display/MAVEN/MojoFailureException
