[[1;34mINFO[m] Scanning for projects...
[[1;34mINFO[m] 
[[1;34mINFO[m] [1m--------------------< [0;36morg.zalando:catwatch-backend[0;1m >--------------------[m
[[1;34mINFO[m] [1mBuilding catwatch-backend 0.0.1-SNAPSHOT[m
[[1;34mINFO[m] [1m--------------------------------[ jar ]---------------------------------[m
[[1;34mINFO[m] 
[[1;34mINFO[m] [1m--- [0;32mmaven-clean-plugin:2.5:clean[m [1m(default-clean)[m @ [36mcatwatch-backend[0;1m ---[m
[[1;34mINFO[m] Deleting /media/rincon/63999417195/eclipse-workspace/EMB-master/jdk_8_maven/cs/rest/original/catwatch/catwatch-backend/target
[[1;34mINFO[m] 
[[1;34mINFO[m] [1m--- [0;32mjacoco-maven-plugin:0.8.7:prepare-agent[m [1m(prepare-agent)[m @ [36mcatwatch-backend[0;1m ---[m
[[1;34mINFO[m] argLine set to -javaagent:/home/rincon/.m2/repository/org/jacoco/org.jacoco.agent/0.8.7/org.jacoco.agent-0.8.7-runtime.jar=destfile=/media/rincon/63999417195/eclipse-workspace/EMB-master/jdk_8_maven/cs/rest/original/catwatch/catwatch-backend/target/jacoco.exec
[[1;34mINFO[m] 
[[1;34mINFO[m] [1m--- [0;32mjacoco-maven-plugin:0.8.7:prepare-agent[m [1m(default)[m @ [36mcatwatch-backend[0;1m ---[m
[[1;34mINFO[m] argLine set to -javaagent:/home/rincon/.m2/repository/org/jacoco/org.jacoco.agent/0.8.7/org.jacoco.agent-0.8.7-runtime.jar=destfile=/media/rincon/63999417195/eclipse-workspace/EMB-master/jdk_8_maven/cs/rest/original/catwatch/catwatch-backend/target/jacoco.exec
[[1;34mINFO[m] 
[[1;34mINFO[m] [1m--- [0;32mapt-maven-plugin:1.1.3:process[m [1m(default)[m @ [36mcatwatch-backend[0;1m ---[m
[[1;34mINFO[m] 
[[1;34mINFO[m] [1m--- [0;32mspring-boot-maven-plugin:1.5.4.RELEASE:build-info[m [1m(default)[m @ [36mcatwatch-backend[0;1m ---[m
[[1;34mINFO[m] 
[[1;34mINFO[m] [1m--- [0;32mmaven-resources-plugin:2.6:resources[m [1m(default-resources)[m @ [36mcatwatch-backend[0;1m ---[m
[[1;34mINFO[m] Using 'UTF-8' encoding to copy filtered resources.
[[1;34mINFO[m] Copying 14 resources
[[1;34mINFO[m] 
[[1;34mINFO[m] [1m--- [0;32mmaven-compiler-plugin:3.8.0:compile[m [1m(default-compile)[m @ [36mcatwatch-backend[0;1m ---[m
[[1;34mINFO[m] Changes detected - recompiling the module!
[[1;34mINFO[m] Compiling 74 source files to /media/rincon/63999417195/eclipse-workspace/EMB-master/jdk_8_maven/cs/rest/original/catwatch/catwatch-backend/target/classes
[[1;34mINFO[m] 
[[1;34mINFO[m] [1m--- [0;32mjacoco-maven-plugin:0.8.7:prepare-agent[m [1m(prepare-agent)[m @ [36mcatwatch-backend[0;1m ---[m
[[1;34mINFO[m] argLine set to -javaagent:/home/rincon/.m2/repository/org/jacoco/org.jacoco.agent/0.8.7/org.jacoco.agent-0.8.7-runtime.jar=destfile=/media/rincon/63999417195/eclipse-workspace/EMB-master/jdk_8_maven/cs/rest/original/catwatch/catwatch-backend/target/jacoco.exec
[[1;34mINFO[m] 
[[1;34mINFO[m] [1m--- [0;32mjacoco-maven-plugin:0.8.7:prepare-agent[m [1m(default)[m @ [36mcatwatch-backend[0;1m ---[m
[[1;34mINFO[m] argLine set to -javaagent:/home/rincon/.m2/repository/org/jacoco/org.jacoco.agent/0.8.7/org.jacoco.agent-0.8.7-runtime.jar=destfile=/media/rincon/63999417195/eclipse-workspace/EMB-master/jdk_8_maven/cs/rest/original/catwatch/catwatch-backend/target/jacoco.exec
[[1;34mINFO[m] 
[[1;34mINFO[m] [1m--- [0;32mapt-maven-plugin:1.1.3:process[m [1m(default)[m @ [36mcatwatch-backend[0;1m ---[m
[[1;34mINFO[m] 
[[1;34mINFO[m] [1m--- [0;32mspring-boot-maven-plugin:1.5.4.RELEASE:build-info[m [1m(default)[m @ [36mcatwatch-backend[0;1m ---[m
[[1;34mINFO[m] 
[[1;34mINFO[m] [1m--- [0;32mmaven-resources-plugin:2.6:resources[m [1m(default-resources)[m @ [36mcatwatch-backend[0;1m ---[m
[[1;34mINFO[m] Using 'UTF-8' encoding to copy filtered resources.
[[1;34mINFO[m] Copying 14 resources
[[1;34mINFO[m] 
[[1;34mINFO[m] [1m--- [0;32mmaven-compiler-plugin:3.8.0:compile[m [1m(default-compile)[m @ [36mcatwatch-backend[0;1m ---[m
[[1;34mINFO[m] Nothing to compile - all classes are up to date
[[1;34mINFO[m] 
[[1;34mINFO[m] [1m--- [0;32mmaven-resources-plugin:2.6:testResources[m [1m(default-testResources)[m @ [36mcatwatch-backend[0;1m ---[m
[[1;34mINFO[m] Using 'UTF-8' encoding to copy filtered resources.
[[1;34mINFO[m] skip non existing resourceDirectory /media/rincon/63999417195/eclipse-workspace/EMB-master/jdk_8_maven/cs/rest/original/catwatch/catwatch-backend/src/test/resources
[[1;34mINFO[m] 
[[1;34mINFO[m] [1m--- [0;32mmaven-compiler-plugin:3.8.0:testCompile[m [1m(default-testCompile)[m @ [36mcatwatch-backend[0;1m ---[m
[[1;34mINFO[m] Changes detected - recompiling the module!
[[1;34mINFO[m] Compiling 1 source file to /media/rincon/63999417195/eclipse-workspace/EMB-master/jdk_8_maven/cs/rest/original/catwatch/catwatch-backend/target/test-classes
[[1;34mINFO[m] 
[[1;34mINFO[m] [1m--- [0;32mjacoco-maven-plugin:0.8.7:prepare-agent[m [1m(prepare-agent)[m @ [36mcatwatch-backend[0;1m ---[m
[[1;34mINFO[m] argLine set to -javaagent:/home/rincon/.m2/repository/org/jacoco/org.jacoco.agent/0.8.7/org.jacoco.agent-0.8.7-runtime.jar=destfile=/media/rincon/63999417195/eclipse-workspace/EMB-master/jdk_8_maven/cs/rest/original/catwatch/catwatch-backend/target/jacoco.exec
[[1;34mINFO[m] 
[[1;34mINFO[m] [1m--- [0;32mjacoco-maven-plugin:0.8.7:prepare-agent[m [1m(default)[m @ [36mcatwatch-backend[0;1m ---[m
[[1;34mINFO[m] argLine set to -javaagent:/home/rincon/.m2/repository/org/jacoco/org.jacoco.agent/0.8.7/org.jacoco.agent-0.8.7-runtime.jar=destfile=/media/rincon/63999417195/eclipse-workspace/EMB-master/jdk_8_maven/cs/rest/original/catwatch/catwatch-backend/target/jacoco.exec
[[1;34mINFO[m] 
[[1;34mINFO[m] [1m--- [0;32mapt-maven-plugin:1.1.3:process[m [1m(default)[m @ [36mcatwatch-backend[0;1m ---[m
[[1;34mINFO[m] 
[[1;34mINFO[m] [1m--- [0;32mspring-boot-maven-plugin:1.5.4.RELEASE:build-info[m [1m(default)[m @ [36mcatwatch-backend[0;1m ---[m
[[1;34mINFO[m] 
[[1;34mINFO[m] [1m--- [0;32mmaven-resources-plugin:2.6:resources[m [1m(default-resources)[m @ [36mcatwatch-backend[0;1m ---[m
[[1;34mINFO[m] Using 'UTF-8' encoding to copy filtered resources.
[[1;34mINFO[m] Copying 14 resources
[[1;34mINFO[m] 
[[1;34mINFO[m] [1m--- [0;32mmaven-compiler-plugin:3.8.0:compile[m [1m(default-compile)[m @ [36mcatwatch-backend[0;1m ---[m
[[1;34mINFO[m] Changes detected - recompiling the module!
[[1;34mINFO[m] Compiling 74 source files to /media/rincon/63999417195/eclipse-workspace/EMB-master/jdk_8_maven/cs/rest/original/catwatch/catwatch-backend/target/classes
[[1;34mINFO[m] 
[[1;34mINFO[m] [1m--- [0;32mmaven-resources-plugin:2.6:testResources[m [1m(default-testResources)[m @ [36mcatwatch-backend[0;1m ---[m
[[1;34mINFO[m] Using 'UTF-8' encoding to copy filtered resources.
[[1;34mINFO[m] skip non existing resourceDirectory /media/rincon/63999417195/eclipse-workspace/EMB-master/jdk_8_maven/cs/rest/original/catwatch/catwatch-backend/src/test/resources
[[1;34mINFO[m] 
[[1;34mINFO[m] [1m--- [0;32mmaven-compiler-plugin:3.8.0:testCompile[m [1m(default-testCompile)[m @ [36mcatwatch-backend[0;1m ---[m
[[1;34mINFO[m] Nothing to compile - all classes are up to date
[[1;34mINFO[m] 
[[1;34mINFO[m] [1m--- [0;32mmaven-surefire-plugin:2.22.0:test[m [1m(default-test)[m @ [36mcatwatch-backend[0;1m ---[m
[[1;34mINFO[m] 
[[1;34mINFO[m] -------------------------------------------------------
[[1;34mINFO[m]  T E S T S
[[1;34mINFO[m] -------------------------------------------------------
[[1;34mINFO[m] Running org.zalando.catwatch.backend.[1msonnet35_run01_ContributorStatsTest[m

  .   ____          _            __ _ _
 /\\ / ___'_ __ _ _(_)_ __  __ _ \ \ \ \
( ( )\___ | '_ | '_| | '_ \/ _` | \ \ \ \
 \\/  ___)| |_)| | | | | || (_| |  ) ) ) )
  '  |____| .__|_| |_|_| |_\__, | / / / /
 =========|_|==============|___/=/_/_/_/
 :: Spring Boot ::        (v1.5.4.RELEASE)

15:00:37.182 [main] INFO  o.a.m.surefire.booter.ForkedBooter - Starting ForkedBooter v2.22.0 on IFTO-PROBOOK with PID 9236 (started by rincon in /media/rincon/63999417195/eclipse-workspace/EMB-master/jdk_8_maven/cs/rest/original/catwatch/catwatch-backend)
15:00:37.187 [main] INFO  o.a.m.surefire.booter.ForkedBooter - No active profile set, falling back to default profiles: default
15:00:37.802 [main] INFO  o.s.b.c.e.AnnotationConfigEmbeddedWebApplicationContext - Refreshing org.springframework.boot.context.embedded.AnnotationConfigEmbeddedWebApplicationContext@36510e73: startup date [Fri Apr 11 15:00:37 BRT 2025]; root of context hierarchy
15:00:37.818 [background-preinit] INFO  o.h.validator.internal.util.Version - HV000001: Hibernate Validator 5.3.5.Final
15:00:39.974 [main] INFO  o.s.b.f.a.AutowiredAnnotationBeanPostProcessor - JSR-330 'javax.inject.Inject' annotation found and supported for autowiring
15:00:40.250 [main] INFO  o.s.c.s.PostProcessorRegistrationDelegate$BeanPostProcessorChecker - Bean 'org.springframework.retry.annotation.RetryConfiguration' of type [org.springframework.retry.annotation.RetryConfiguration$$EnhancerBySpringCGLIB$$57eb736c] is not eligible for getting processed by all BeanPostProcessors (for example: not eligible for auto-proxying)
15:00:40.293 [main] INFO  o.s.c.s.PostProcessorRegistrationDelegate$BeanPostProcessorChecker - Bean 'org.springframework.transaction.annotation.ProxyTransactionManagementConfiguration' of type [org.springframework.transaction.annotation.ProxyTransactionManagementConfiguration$$EnhancerBySpringCGLIB$$6227db47] is not eligible for getting processed by all BeanPostProcessors (for example: not eligible for auto-proxying)
15:00:40.829 [main] INFO  o.s.b.c.e.t.TomcatEmbeddedServletContainer - Tomcat initialized with port(s): 0 (http)
15:00:40.851 [main] INFO  o.a.catalina.core.StandardService - Starting service [Tomcat]
15:00:40.853 [main] INFO  o.a.catalina.core.StandardEngine - Starting Servlet Engine: Apache Tomcat/8.5.15
15:00:40.979 [localhost-startStop-1] INFO  o.a.c.c.C.[Tomcat].[localhost].[/] - Initializing Spring embedded WebApplicationContext
15:00:40.979 [localhost-startStop-1] INFO  o.s.web.context.ContextLoader - Root WebApplicationContext: initialization completed in 3181 ms
15:00:41.301 [localhost-startStop-1] INFO  o.s.b.w.s.FilterRegistrationBean - Mapping filter: 'metricsFilter' to: [/*]
15:00:41.302 [localhost-startStop-1] INFO  o.s.b.w.s.FilterRegistrationBean - Mapping filter: 'characterEncodingFilter' to: [/*]
15:00:41.302 [localhost-startStop-1] INFO  o.s.b.w.s.FilterRegistrationBean - Mapping filter: 'hiddenHttpMethodFilter' to: [/*]
15:00:41.302 [localhost-startStop-1] INFO  o.s.b.w.s.FilterRegistrationBean - Mapping filter: 'httpPutFormContentFilter' to: [/*]
15:00:41.302 [localhost-startStop-1] INFO  o.s.b.w.s.FilterRegistrationBean - Mapping filter: 'requestContextFilter' to: [/*]
15:00:41.304 [localhost-startStop-1] INFO  o.s.b.w.s.DelegatingFilterProxyRegistrationBean - Mapping filter: 'springSecurityFilterChain' to: [/*]
15:00:41.305 [localhost-startStop-1] INFO  o.s.b.w.s.FilterRegistrationBean - Mapping filter: 'webRequestLoggingFilter' to: [/*]
15:00:41.305 [localhost-startStop-1] INFO  o.s.b.w.s.FilterRegistrationBean - Mapping filter: 'corsFilter' to: [/*]
15:00:41.305 [localhost-startStop-1] INFO  o.s.b.w.s.FilterRegistrationBean - Mapping filter: 'applicationContextIdFilter' to: [/*]
15:00:41.305 [localhost-startStop-1] INFO  o.s.b.w.s.ServletRegistrationBean - Mapping servlet: 'dispatcherServlet' to [/]
15:00:41.933 [main] INFO  o.f.c.internal.util.VersionPrinter - Flyway 3.2.1 by Boxfuse
15:00:41.940 [main] INFO  o.f.c.i.dbsupport.DbSupportFactory - Database: jdbc:h2:mem:testdb (H2 1.4)
15:00:41.978 [main] INFO  o.f.core.internal.command.DbValidate - Validated 6 migrations (execution time 00:00.012s)
15:00:41.997 [main] INFO  o.f.c.i.m.MetaDataTableImpl - Creating Metadata table: "PUBLIC"."schema_version"
15:00:42.024 [main] INFO  o.f.core.internal.command.DbMigrate - Current version of schema "PUBLIC": << Empty Schema >>
15:00:42.024 [main] INFO  o.f.core.internal.command.DbMigrate - Migrating schema "PUBLIC" to version 001 - base version
15:00:42.051 [main] INFO  o.f.core.internal.command.DbMigrate - Migrating schema "PUBLIC" to version 002 - test baseline on migrate
15:00:42.058 [main] INFO  o.f.core.internal.command.DbMigrate - Migrating schema "PUBLIC" to version 003 - change varchar to text
15:00:42.135 [main] INFO  o.f.core.internal.command.DbMigrate - Migrating schema "PUBLIC" to version 004 - maintainers
15:00:42.143 [main] INFO  o.f.core.internal.command.DbMigrate - Migrating schema "PUBLIC" to version 005 - catwatch yaml
15:00:42.159 [main] INFO  o.f.core.internal.command.DbMigrate - Migrating schema "PUBLIC" to version 006 - add external contributors
15:00:42.173 [main] INFO  o.f.core.internal.command.DbMigrate - Successfully applied 6 migrations to schema "PUBLIC" (execution time 00:00.178s).
15:00:42.308 [main] INFO  o.s.o.j.LocalContainerEntityManagerFactoryBean - Building JPA container EntityManagerFactory for persistence unit 'default'
15:00:42.331 [main] INFO  o.h.jpa.internal.util.LogHelper - HHH000204: Processing PersistenceUnitInfo [
	name: default
	...]
15:00:42.417 [main] INFO  org.hibernate.Version - HHH000412: Hibernate Core {5.0.12.Final}
15:00:42.419 [main] INFO  org.hibernate.cfg.Environment - HHH000206: hibernate.properties not found
15:00:42.421 [main] INFO  org.hibernate.cfg.Environment - HHH000021: Bytecode provider name : javassist
15:00:42.469 [main] INFO  o.h.annotations.common.Version - HCANN000001: Hibernate Commons Annotations {5.0.1.Final}
15:00:42.592 [main] INFO  org.hibernate.dialect.Dialect - HHH000400: Using dialect: org.hibernate.dialect.H2Dialect
15:00:42.899 [main] WARN  org.hibernate.mapping.RootClass - HHH000038: Composite-id class does not override equals(): org.zalando.catwatch.backend.model.StatisticsKey
15:00:42.899 [main] WARN  org.hibernate.mapping.RootClass - HHH000039: Composite-id class does not override hashCode(): org.zalando.catwatch.backend.model.StatisticsKey
15:00:42.899 [main] WARN  org.hibernate.mapping.RootClass - HHH000038: Composite-id class does not override equals(): org.zalando.catwatch.backend.model.ContributorKey
15:00:42.899 [main] WARN  org.hibernate.mapping.RootClass - HHH000039: Composite-id class does not override hashCode(): org.zalando.catwatch.backend.model.ContributorKey
15:00:43.188 [main] INFO  o.h.tool.hbm2ddl.SchemaUpdate - HHH000228: Running hbm2ddl schema update
15:00:43.339 [main] INFO  o.s.o.j.LocalContainerEntityManagerFactoryBean - Initialized JPA EntityManagerFactory for persistence unit 'default'
15:00:43.410 [main] INFO  o.z.c.b.github.SnapshotProvider - Cache directory 'target/cache' is not found. Creating new directory.
15:00:43.411 [main] INFO  o.z.c.b.github.SnapshotProvider - Cache directory created successfully.
15:00:43.432 [main] INFO  o.z.c.b.github.SnapshotProvider - Initialized http client with 50 mb cache.
15:00:44.001 [main] INFO  o.h.h.i.QueryTranslatorFactoryInitiator - HHH000397: Using ASTQueryTranslatorFactory
15:00:44.950 [main] INFO  o.s.w.s.m.m.a.RequestMappingHandlerMapping - Mapped "{[/contributors],methods=[GET],produces=[application/json]}" onto public java.util.List<org.zalando.catwatch.backend.model.Contributor> org.zalando.catwatch.backend.web.ContributorsApi.contributorsGet(java.lang.String,java.lang.Integer,java.lang.Integer,java.lang.String,java.lang.String,java.lang.String,java.lang.String)
15:00:44.952 [main] INFO  o.s.w.s.m.m.a.RequestMappingHandlerMapping - Mapped "{[/languages],methods=[GET],produces=[application/json]}" onto public org.springframework.http.ResponseEntity<java.util.Collection<org.zalando.catwatch.backend.model.Language>> org.zalando.catwatch.backend.web.LanguagesApi.languagesGet(java.lang.String,java.lang.Integer,java.lang.Integer,java.lang.String)
15:00:44.954 [main] INFO  o.s.w.s.m.m.a.RequestMappingHandlerMapping - Mapped "{[/projects],methods=[GET],produces=[application/json]}" onto public org.springframework.http.ResponseEntity<java.util.Collection<org.zalando.catwatch.backend.model.Project>> org.zalando.catwatch.backend.web.ProjectsApi.projectsGet(java.lang.String,java.lang.Integer,java.lang.Integer,java.util.Date,java.util.Date,java.lang.String,java.lang.String,java.lang.String)
15:00:44.956 [main] INFO  o.s.w.s.m.m.a.RequestMappingHandlerMapping - Mapped "{[/statistics/projects],methods=[GET],produces=[application/json]}" onto public org.springframework.http.ResponseEntity<java.util.Collection<org.zalando.catwatch.backend.util.ProjectStats>> org.zalando.catwatch.backend.web.StatisticsApi.statisticsProjectGet(java.lang.String,java.lang.String,java.lang.String) throws java.text.ParseException
15:00:44.957 [main] INFO  o.s.w.s.m.m.a.RequestMappingHandlerMapping - Mapped "{[/statistics/contributors],methods=[GET],produces=[application/json]}" onto public org.springframework.http.ResponseEntity<java.util.Collection<org.zalando.catwatch.backend.util.ContributorStats>> org.zalando.catwatch.backend.web.StatisticsApi.statisticsContributorGet(java.lang.String,java.lang.String,java.lang.String) throws java.text.ParseException
15:00:44.958 [main] INFO  o.s.w.s.m.m.a.RequestMappingHandlerMapping - Mapped "{[/statistics/languages],methods=[GET],produces=[application/json]}" onto public org.springframework.http.ResponseEntity<java.util.Collection<org.zalando.catwatch.backend.util.LanguageStats>> org.zalando.catwatch.backend.web.StatisticsApi.statisticsLanguagesGet(java.lang.String,java.lang.String,java.lang.String)
15:00:44.958 [main] INFO  o.s.w.s.m.m.a.RequestMappingHandlerMapping - Mapped "{[/statistics],methods=[GET],produces=[application/json]}" onto public org.springframework.http.ResponseEntity<java.util.Collection<org.zalando.catwatch.backend.model.Statistics>> org.zalando.catwatch.backend.web.StatisticsApi.statisticsGet(java.lang.String,java.lang.String,java.lang.String)
15:00:44.961 [main] INFO  o.s.w.s.m.m.a.RequestMappingHandlerMapping - Mapped "{[/delete],methods=[GET],produces=[application/json;charset=utf-8]}" onto public java.lang.String org.zalando.catwatch.backend.web.admin.AdminController.deleteAll()
15:00:44.962 [main] INFO  o.s.w.s.m.m.a.RequestMappingHandlerMapping - Mapped "{[/export],methods=[GET],produces=[application/json;charset=utf-8]}" onto public org.zalando.catwatch.backend.web.admin.DatabaseDto org.zalando.catwatch.backend.web.admin.AdminController.exportJson()
15:00:44.962 [main] INFO  o.s.w.s.m.m.a.RequestMappingHandlerMapping - Mapped "{[/import],methods=[POST],produces=[application/json;charset=utf-8]}" onto public java.lang.String org.zalando.catwatch.backend.web.admin.AdminController.importJson(org.zalando.catwatch.backend.web.admin.DatabaseDto)
15:00:44.963 [main] INFO  o.s.w.s.m.m.a.RequestMappingHandlerMapping - Mapped "{[/config/scoring.project],methods=[POST],produces=[application/json;charset=utf-8]}" onto public java.util.List<java.lang.String> org.zalando.catwatch.backend.web.admin.AdminController.configScoringProjects(java.lang.String,java.lang.String)
15:00:44.964 [main] INFO  o.s.w.s.m.m.a.RequestMappingHandlerMapping - Mapped "{[/init],methods=[GET],produces=[application/json;charset=utf-8]}" onto public java.lang.String org.zalando.catwatch.backend.web.admin.AdminController.init()
15:00:44.965 [main] INFO  o.s.w.s.m.m.a.RequestMappingHandlerMapping - Mapped "{[/config],methods=[GET],produces=[application/json]}" onto public java.util.Map<java.lang.String, java.lang.String> org.zalando.catwatch.backend.web.config.ConfigController.config() throws java.lang.Exception
15:00:44.966 [main] INFO  o.s.w.s.m.m.a.RequestMappingHandlerMapping - Mapped "{[/fetch],methods=[GET],produces=[application/json;charset=utf-8]}" onto public java.lang.String org.zalando.catwatch.backend.web.fetch.FetchController.fetch() throws java.lang.Exception
15:00:44.971 [main] INFO  o.s.w.s.m.m.a.RequestMappingHandlerMapping - Mapped "{[/swagger-resources]}" onto public org.springframework.http.ResponseEntity<java.util.List<springfox.documentation.swagger.web.SwaggerResource>> springfox.documentation.swagger.web.ApiResourceController.swaggerResources()
15:00:44.973 [main] INFO  o.s.w.s.m.m.a.RequestMappingHandlerMapping - Mapped "{[/swagger-resources/configuration/security]}" onto public org.springframework.http.ResponseEntity<springfox.documentation.swagger.web.SecurityConfiguration> springfox.documentation.swagger.web.ApiResourceController.securityConfiguration()
15:00:44.974 [main] INFO  o.s.w.s.m.m.a.RequestMappingHandlerMapping - Mapped "{[/swagger-resources/configuration/ui]}" onto public org.springframework.http.ResponseEntity<springfox.documentation.swagger.web.UiConfiguration> springfox.documentation.swagger.web.ApiResourceController.uiConfiguration()
15:00:44.977 [main] INFO  o.s.w.s.m.m.a.RequestMappingHandlerMapping - Mapped "{[/error],produces=[text/html]}" onto public org.springframework.web.servlet.ModelAndView org.springframework.boot.autoconfigure.web.BasicErrorController.errorHtml(javax.servlet.http.HttpServletRequest,javax.servlet.http.HttpServletResponse)
15:00:44.977 [main] INFO  o.s.w.s.m.m.a.RequestMappingHandlerMapping - Mapped "{[/error]}" onto public org.springframework.http.ResponseEntity<java.util.Map<java.lang.String, java.lang.Object>> org.springframework.boot.autoconfigure.web.BasicErrorController.error(javax.servlet.http.HttpServletRequest)
15:00:45.337 [main] INFO  o.s.b.a.e.mvc.EndpointHandlerMapping - Mapped "{[/health || /health.json],methods=[GET],produces=[application/vnd.spring-boot.actuator.v1+json || application/json]}" onto public java.lang.Object org.springframework.boot.actuate.endpoint.mvc.HealthMvcEndpoint.invoke(javax.servlet.http.HttpServletRequest,java.security.Principal)
15:00:45.635 [main] INFO  o.s.b.a.s.AuthenticationManagerConfiguration - 

Using default security password: 8bef4302-90c2-4ec5-89fa-dea01f88a272

15:00:45.942 [main] INFO  o.s.s.web.DefaultSecurityFilterChain - Creating filter chain: org.springframework.security.web.util.matcher.AnyRequestMatcher@1, [org.springframework.security.web.context.request.async.WebAsyncManagerIntegrationFilter@26c06f25, org.springframework.security.web.context.SecurityContextPersistenceFilter@68583a84, org.springframework.security.web.header.HeaderWriterFilter@e941116, org.springframework.security.web.authentication.logout.LogoutFilter@427cafd, org.springframework.security.oauth2.provider.authentication.OAuth2AuthenticationProcessingFilter@7e7d298c, org.springframework.security.web.savedrequest.RequestCacheAwareFilter@2f8d74ed, org.springframework.security.web.servletapi.SecurityContextHolderAwareRequestFilter@66aeb02b, org.springframework.security.web.authentication.AnonymousAuthenticationFilter@431293eb, org.springframework.security.web.session.SessionManagementFilter@77231cf1, org.springframework.security.web.access.ExceptionTranslationFilter@75cf1b91, org.springframework.security.web.access.intercept.FilterSecurityInterceptor@27f10289]
15:00:45.961 [main] INFO  o.s.s.web.DefaultSecurityFilterChain - Creating filter chain: org.springframework.boot.actuate.autoconfigure.ManagementWebSecurityAutoConfiguration$LazyEndpointPathRequestMatcher@7db67ae9, [org.springframework.security.web.context.request.async.WebAsyncManagerIntegrationFilter@766fec38, org.springframework.security.web.context.SecurityContextPersistenceFilter@1cb7e07f, org.springframework.security.web.header.HeaderWriterFilter@16a9f20a, org.springframework.security.web.authentication.logout.LogoutFilter@7f4ae7e8, org.springframework.security.web.authentication.www.BasicAuthenticationFilter@378edc44, org.springframework.security.web.savedrequest.RequestCacheAwareFilter@16d79a7d, org.springframework.security.web.servletapi.SecurityContextHolderAwareRequestFilter@4fb7030f, org.springframework.security.web.authentication.AnonymousAuthenticationFilter@37c2724d, org.springframework.security.web.session.SessionManagementFilter@22eb6ebc, org.springframework.security.web.access.ExceptionTranslationFilter@1b323b17, org.springframework.security.web.access.intercept.FilterSecurityInterceptor@35b00349]
15:00:46.021 [main] INFO  s.d.s.w.PropertySourcedRequestMappingHandlerMapping - Mapped URL path [/v2/api-docs] onto method [public org.springframework.http.ResponseEntity<springfox.documentation.spring.web.json.Json> springfox.documentation.swagger2.web.Swagger2Controller.getDocumentation(java.lang.String,javax.servlet.http.HttpServletRequest)]
15:00:46.393 [main] INFO  o.s.w.s.m.m.a.RequestMappingHandlerAdapter - Looking for @ControllerAdvice: org.springframework.boot.context.embedded.AnnotationConfigEmbeddedWebApplicationContext@36510e73: startup date [Fri Apr 11 15:00:37 BRT 2025]; root of context hierarchy
15:00:46.514 [main] INFO  o.s.w.s.h.SimpleUrlHandlerMapping - Mapped URL path [/webjars/**] onto handler of type [class org.springframework.web.servlet.resource.ResourceHttpRequestHandler]
15:00:46.514 [main] INFO  o.s.w.s.h.SimpleUrlHandlerMapping - Mapped URL path [/**] onto handler of type [class org.springframework.web.servlet.resource.ResourceHttpRequestHandler]
15:00:46.564 [main] INFO  o.s.w.s.h.SimpleUrlHandlerMapping - Mapped URL path [/**/favicon.ico] onto handler of type [class org.springframework.web.servlet.resource.ResourceHttpRequestHandler]
15:00:46.597 [main] INFO  o.s.b.a.w.WebMvcAutoConfiguration$WelcomePageHandlerMapping - Adding welcome page: class path resource [static/index.html]
15:00:46.990 [main] INFO  o.s.j.e.a.AnnotationMBeanExporter - Registering beans for JMX exposure on startup
15:00:46.997 [main] INFO  o.s.b.a.e.jmx.EndpointMBeanExporter - Registering beans for JMX exposure on startup
15:00:47.003 [main] INFO  o.s.c.s.DefaultLifecycleProcessor - Starting beans in phase 0
15:00:47.014 [main] INFO  o.s.b.a.e.jmx.EndpointMBeanExporter - Located managed bean 'healthEndpoint': registering with JMX server as MBean [org.springframework.boot:type=Endpoint,name=healthEndpoint]
15:00:47.032 [main] INFO  o.s.c.s.DefaultLifecycleProcessor - Starting beans in phase 2147483647
15:00:47.032 [main] INFO  s.d.s.w.p.DocumentationPluginsBootstrapper - Context refreshed
15:00:47.063 [main] INFO  s.d.s.w.p.DocumentationPluginsBootstrapper - Found 1 custom documentation plugin(s)
15:00:47.118 [main] INFO  s.d.s.w.s.ApiListingReferenceScanner - Scanning for api listing references
15:00:47.512 [main] INFO  s.d.s.w.r.o.CachingOperationNameGenerator - Generating unique operation named: invokeUsingGET_1
15:00:47.619 [main] INFO  o.s.s.a.ScheduledAnnotationBeanPostProcessor - No TaskScheduler/ScheduledExecutorService bean found for scheduled processing
15:00:47.637 [main] INFO  o.a.coyote.http11.Http11NioProtocol - Initializing ProtocolHandler ["http-nio-auto-1"]
15:00:47.660 [main] INFO  o.a.coyote.http11.Http11NioProtocol - Starting ProtocolHandler ["http-nio-auto-1"]
15:00:47.667 [main] INFO  o.a.tomcat.util.net.NioSelectorPool - Using a shared selector for servlet write/read
15:00:47.693 [main] INFO  o.s.b.c.e.t.TomcatEmbeddedServletContainer - Tomcat started on port(s): 43461 (http)
15:00:47.702 [main] INFO  o.a.m.surefire.booter.ForkedBooter - Started ForkedBooter in 10.957 seconds (JVM running for 12.085)
15:00:48.307 [main] INFO  o.s.c.s.DefaultLifecycleProcessor - Stopping beans in phase 2147483647
15:00:48.308 [main] INFO  o.s.c.s.DefaultLifecycleProcessor - Stopping beans in phase 0
[[1;31mERROR[m] [1;31mTests [0;1mrun: [0;1m6[m, Failures: 0, [1;31mErrors: [0;1;31m5[m, Skipped: 0, Time elapsed: 12.125 s[1;31m <<< FAILURE![m - in org.zalando.catwatch.backend.[1msonnet35_run01_ContributorStatsTest[m
[[1;31mERROR[m] testGetDistinctContributors(org.zalando.catwatch.backend.sonnet35_run01_ContributorStatsTest)  Time elapsed: 0.01 s  <<< ERROR!
java.lang.IllegalArgumentException: Could not determinate loginId.
	at org.zalando.catwatch.backend.sonnet35_run01_ContributorStatsTest.testGetDistinctContributors(sonnet35_run01_ContributorStatsTest.java:116)

[[1;31mERROR[m] testConstructorWithDifferentLoginIds(org.zalando.catwatch.backend.sonnet35_run01_ContributorStatsTest)  Time elapsed: 0.003 s  <<< ERROR!
java.lang.Exception: Unexpected exception, expected<java.lang.IllegalArgumentException> but was<java.lang.NullPointerException>
	at org.zalando.catwatch.backend.sonnet35_run01_ContributorStatsTest.testConstructorWithDifferentLoginIds(sonnet35_run01_ContributorStatsTest.java:98)

[[1;31mERROR[m] testBuildStats(org.zalando.catwatch.backend.sonnet35_run01_ContributorStatsTest)  Time elapsed: 0.003 s  <<< ERROR!
java.lang.IllegalArgumentException: Could not determinate loginId.
	at org.zalando.catwatch.backend.sonnet35_run01_ContributorStatsTest.testBuildStats(sonnet35_run01_ContributorStatsTest.java:134)

[[1;31mERROR[m] testToString(org.zalando.catwatch.backend.sonnet35_run01_ContributorStatsTest)  Time elapsed: 0.003 s  <<< ERROR!
java.lang.IllegalArgumentException: Contributor loginId could not be determinated.
	at org.zalando.catwatch.backend.sonnet35_run01_ContributorStatsTest.testToString(sonnet35_run01_ContributorStatsTest.java:149)

[[1;31mERROR[m] testConstructor(org.zalando.catwatch.backend.sonnet35_run01_ContributorStatsTest)  Time elapsed: 0.002 s  <<< ERROR!
java.lang.IllegalArgumentException: Contributor loginId could not be determinated.
	at org.zalando.catwatch.backend.sonnet35_run01_ContributorStatsTest.testConstructor(sonnet35_run01_ContributorStatsTest.java:61)

15:00:48.363 [Thread-6] INFO  o.s.b.c.e.AnnotationConfigEmbeddedWebApplicationContext - Closing org.springframework.boot.context.embedded.AnnotationConfigEmbeddedWebApplicationContext@36510e73: startup date [Fri Apr 11 15:00:37 BRT 2025]; root of context hierarchy
15:00:48.367 [Thread-6] INFO  o.s.c.s.DefaultLifecycleProcessor - Stopping beans in phase 2147483647
15:00:48.367 [Thread-6] INFO  o.s.c.s.DefaultLifecycleProcessor - Stopping beans in phase 0
15:00:48.368 [Thread-6] INFO  o.s.b.a.e.jmx.EndpointMBeanExporter - Unregistering JMX-exposed beans on shutdown
15:00:48.368 [Thread-6] INFO  o.s.b.a.e.jmx.EndpointMBeanExporter - Unregistering JMX-exposed beans
15:00:48.369 [Thread-6] INFO  o.s.j.e.a.AnnotationMBeanExporter - Unregistering JMX-exposed beans on shutdown
15:00:48.376 [Thread-6] INFO  o.s.o.j.LocalContainerEntityManagerFactoryBean - Closing JPA EntityManagerFactory for persistence unit 'default'
[[1;34mINFO[m] 
[[1;34mINFO[m] Results:
[[1;34mINFO[m] 
[[1;31mERROR[m] [1;31mErrors: [m
[[1;31mERROR[m] [1;31m  sonnet35_run01_ContributorStatsTest.testBuildStats:134 » IllegalArgument Could...[m
[[1;31mERROR[m] [1;31m  sonnet35_run01_ContributorStatsTest.testConstructor:61 » IllegalArgument Contr...[m
[[1;31mERROR[m] [1;31m  sonnet35_run01_ContributorStatsTest.testConstructorWithDifferentLoginIds »  Un...[m
[[1;31mERROR[m] [1;31m  sonnet35_run01_ContributorStatsTest.testGetDistinctContributors:116 » IllegalArgument[m
[[1;31mERROR[m] [1;31m  sonnet35_run01_ContributorStatsTest.testToString:149 » IllegalArgument Contrib...[m
[[1;34mINFO[m] 
[[1;31mERROR[m] [1;31mTests run: 6, Failures: 0, Errors: 5, Skipped: 0[m
[[1;34mINFO[m] 
[[1;34mINFO[m] [1m------------------------------------------------------------------------[m
[[1;34mINFO[m] [1;31mBUILD FAILURE[m
[[1;34mINFO[m] [1m------------------------------------------------------------------------[m
[[1;34mINFO[m] Total time:  19.210 s
[[1;34mINFO[m] Finished at: 2025-04-11T15:00:49-03:00
[[1;34mINFO[m] [1m------------------------------------------------------------------------[m
[[1;31mERROR[m] Failed to execute goal [32morg.apache.maven.plugins:maven-surefire-plugin:2.22.0:test[m [1m(default-test)[m on project [36mcatwatch-backend[m: [1;31mThere are test failures.[m
[[1;31mERROR[m] [1;31m[m
[[1;31mERROR[m] [1;31mPlease refer to /media/rincon/63999417195/eclipse-workspace/EMB-master/jdk_8_maven/cs/rest/original/catwatch/catwatch-backend/target/surefire-reports for the individual test results.[m
[[1;31mERROR[m] [1;31mPlease refer to dump files (if any exist) [date]-jvmRun[N].dump, [date].dumpstream and [date]-jvmRun[N].dumpstream.[m
[[1;31mERROR[m] -> [1m[Help 1][m
[[1;31mERROR[m] 
[[1;31mERROR[m] To see the full stack trace of the errors, re-run Maven with the [1m-e[m switch.
[[1;31mERROR[m] Re-run Maven using the [1m-X[m switch to enable full debug logging.
[[1;31mERROR[m] 
[[1;31mERROR[m] For more information about the errors and possible solutions, please read the following articles:
[[1;31mERROR[m] [1m[Help 1][m http://cwiki.apache.org/confluence/display/MAVEN/MojoFailureException
